Parsed test spec with 3 sessions

starting permutation: expl showplan s1l upd s1c sel
step expl: INSERT INTO epq_expl VALUES (true); UPDATE docs SET status = status WHERE id = 1; DELETE FROM epq_expl;
step showplan: SELECT ln FROM epq_plan ORDER BY seq;
ln                                     
---------------------------------------
Update on audit_target t               
  ->  Hash Join                        
        Hash Cond: (t.id = n.id)       
        ->  Seq Scan on audit_target t 
        ->  Hash                       
              ->  Named Tuplestore Scan
(6 rows)

step s1l: UPDATE audit_target SET hits = hits + 10 WHERE id = 2;
step upd: UPDATE docs SET status = 'touched' WHERE id = 2; <waiting ...>
step s1c: COMMIT;
step upd: <... completed>
step sel: SELECT id, hits FROM audit_target ORDER BY id;
id|hits
--+----
 1|   1
 2|  11
 3|   0
 4|   0
 5|   0
(5 rows)


starting permutation: expl showplan s1k upd s1c sel
step expl: INSERT INTO epq_expl VALUES (true); UPDATE docs SET status = status WHERE id = 1; DELETE FROM epq_expl;
step showplan: SELECT ln FROM epq_plan ORDER BY seq;
ln                                     
---------------------------------------
Update on audit_target t               
  ->  Hash Join                        
        Hash Cond: (t.id = n.id)       
        ->  Seq Scan on audit_target t 
        ->  Hash                       
              ->  Named Tuplestore Scan
(6 rows)

step s1k: DELETE FROM audit_target WHERE id = 2;
step upd: UPDATE docs SET status = 'touched' WHERE id = 2; <waiting ...>
step s1c: COMMIT;
step upd: <... completed>
step sel: SELECT id, hits FROM audit_target ORDER BY id;
id|hits
--+----
 1|   1
 3|   0
 4|   0
 5|   0
(4 rows)

