Parsed test spec with 3 sessions

starting permutation: expl s1u upd s1c sel
step expl: EXPLAIN (COSTS OFF) UPDATE st SET v = st.v + ms.d FROM ms WHERE st.k < ms.k;
QUERY PLAN                        
----------------------------------
Update on st                      
  ->  Nested Loop                 
        Join Filter: (st.k < ms.k)
        ->  Seq Scan on st        
        ->  Materialize           
              ->  Seq Scan on ms  
(6 rows)

step s1u: UPDATE st SET v = v + 100 WHERE k = 1;
step upd: UPDATE st SET v = st.v + ms.d FROM ms WHERE st.k < ms.k RETURNING st.k, st.v; <waiting ...>
step s1c: COMMIT;
step upd: <... completed>
k|  v
-+---
1|116
(1 row)

step sel: SELECT k, v FROM st ORDER BY k;
k|  v
-+---
1|116
2| 20
(2 rows)


starting permutation: expl s1k upd s1c sel
step expl: EXPLAIN (COSTS OFF) UPDATE st SET v = st.v + ms.d FROM ms WHERE st.k < ms.k;
QUERY PLAN                        
----------------------------------
Update on st                      
  ->  Nested Loop                 
        Join Filter: (st.k < ms.k)
        ->  Seq Scan on st        
        ->  Materialize           
              ->  Seq Scan on ms  
(6 rows)

step s1k: UPDATE st SET k = 3 WHERE k = 1;
step upd: UPDATE st SET v = st.v + ms.d FROM ms WHERE st.k < ms.k RETURNING st.k, st.v; <waiting ...>
step s1c: COMMIT;
step upd: <... completed>
k|v
-+-
(0 rows)

step sel: SELECT k, v FROM st ORDER BY k;
k| v
-+--
2|20
3|10
(2 rows)

