Parsed test spec with 3 sessions

starting permutation: expl s1r s1u lock s1c sel
step expl: EXPLAIN (COSTS OFF) SELECT d.* FROM docs d JOIN (SELECT DISTINCT doc_id FROM approvals WHERE approved) a ON a.doc_id = d.id FOR UPDATE OF d;
QUERY PLAN                                          
----------------------------------------------------
LockRows                                            
  ->  Merge Join                                    
        Merge Cond: (d.id = a.doc_id)               
        ->  Sort                                    
              Sort Key: d.id                        
              ->  Seq Scan on docs d                
        ->  Subquery Scan on a                      
              ->  Unique                            
                    ->  Sort                        
                          Sort Key: approvals.doc_id
                          ->  Seq Scan on approvals 
                                Filter: approved    
(12 rows)

step s1r: UPDATE approvals SET approved = false WHERE doc_id = 3;
step s1u: UPDATE docs SET status = 'revoked' WHERE id = 3;
step lock: SELECT d.* FROM docs d JOIN (SELECT DISTINCT doc_id FROM approvals WHERE approved) a ON a.doc_id = d.id FOR UPDATE OF d; <waiting ...>
step s1c: COMMIT;
step lock: <... completed>
id|status 
--+-------
 1|pending
 2|pending
 3|revoked
 4|pending
 5|pending
(5 rows)

step sel: SELECT id, status FROM docs ORDER BY id;
id|status 
--+-------
 1|pending
 2|pending
 3|revoked
 4|pending
 5|pending
(5 rows)


starting permutation: expl s1r s1k lock s1c sel
step expl: EXPLAIN (COSTS OFF) SELECT d.* FROM docs d JOIN (SELECT DISTINCT doc_id FROM approvals WHERE approved) a ON a.doc_id = d.id FOR UPDATE OF d;
QUERY PLAN                                          
----------------------------------------------------
LockRows                                            
  ->  Merge Join                                    
        Merge Cond: (d.id = a.doc_id)               
        ->  Sort                                    
              Sort Key: d.id                        
              ->  Seq Scan on docs d                
        ->  Subquery Scan on a                      
              ->  Unique                            
                    ->  Sort                        
                          Sort Key: approvals.doc_id
                          ->  Seq Scan on approvals 
                                Filter: approved    
(12 rows)

step s1r: UPDATE approvals SET approved = false WHERE doc_id = 3;
step s1k: UPDATE docs SET id = 99 WHERE id = 3;
step lock: SELECT d.* FROM docs d JOIN (SELECT DISTINCT doc_id FROM approvals WHERE approved) a ON a.doc_id = d.id FOR UPDATE OF d; <waiting ...>
step s1c: COMMIT;
step lock: <... completed>
id|status 
--+-------
 1|pending
 2|pending
 4|pending
 5|pending
(4 rows)

step sel: SELECT id, status FROM docs ORDER BY id;
id|status 
--+-------
 1|pending
 2|pending
 4|pending
 5|pending
99|pending
(5 rows)

