Parsed test spec with 3 sessions

starting permutation: expl s1u upd s1c sel
step expl: EXPLAIN (COSTS OFF) UPDATE st SET v = st.v + s.d FROM (VALUES (1, 5), (2, 6)) AS s(k, d) WHERE st.k = s.k AND st.k = 1;
QUERY PLAN                                
------------------------------------------
Update on st                              
  ->  Nested Loop                         
        ->  Index Scan using st_pkey on st
              Index Cond: (k = 1)         
        ->  Values Scan on "*VALUES*"     
              Filter: (column1 = 1)       
(6 rows)

step s1u: UPDATE st SET v = v + 100 WHERE k = 1;
step upd: UPDATE st SET v = st.v + s.d FROM (VALUES (1, 5), (2, 6)) AS s(k, d) WHERE st.k = s.k AND st.k = 1 RETURNING st.k, st.v; <waiting ...>
step s1c: COMMIT;
step upd: <... completed>
k|  v
-+---
1|115
(1 row)

step sel: SELECT k, v FROM st ORDER BY k;
k|  v
-+---
1|115
2| 20
(2 rows)


starting permutation: expl s1k upd s1c sel
step expl: EXPLAIN (COSTS OFF) UPDATE st SET v = st.v + s.d FROM (VALUES (1, 5), (2, 6)) AS s(k, d) WHERE st.k = s.k AND st.k = 1;
QUERY PLAN                                
------------------------------------------
Update on st                              
  ->  Nested Loop                         
        ->  Index Scan using st_pkey on st
              Index Cond: (k = 1)         
        ->  Values Scan on "*VALUES*"     
              Filter: (column1 = 1)       
(6 rows)

step s1k: UPDATE st SET k = 3 WHERE k = 1;
step upd: UPDATE st SET v = st.v + s.d FROM (VALUES (1, 5), (2, 6)) AS s(k, d) WHERE st.k = s.k AND st.k = 1 RETURNING st.k, st.v; <waiting ...>
step s1c: COMMIT;
step upd: <... completed>
k|v
-+-
(0 rows)

step sel: SELECT k, v FROM st ORDER BY k;
k| v
-+--
2|20
3|10
(2 rows)

