-- walker-arms witness corpus: one SQL witness per allowlisted row of
-- crates/_support/seams_init/tests/lint-walker-arms.allow (ELSEWHERE / NOOP /
-- UNREACHABLE classes). Each section is headed by the allowlist key it
-- witnesses; the SQL is what makes C take the arm (or proves the arm cannot
-- be reached from SQL). Expected output is captured from stock PostgreSQL
-- 18.6 (scripts/walker-arms-witness-e2e.sh) and both binaries must match it
-- byte-for-byte. Keep it deterministic: no timing, no worker counts.
\set VERBOSITY verbose
SET client_min_messages = warning;
SET max_parallel_workers_per_gather = 0;
SET jit = off;
-- ===== common fixtures =====
CREATE TABLE wa (id int PRIMARY KEY, x int, b boolean, v varchar(10), t text);
INSERT INTO wa SELECT i, i % 10, i % 2 = 0, 'v' || (i % 5), 't' || i FROM generate_series(1, 1000) i;
CREATE INDEX wa_x ON wa (x);
CREATE TABLE wb (id int PRIMARY KEY, y int);
INSERT INTO wb SELECT i, i % 7 FROM generate_series(1, 500) i;
VACUUM ANALYZE wa;
VACUUM ANALYZE wb;
-- ===== src/backend/utils/adt/ruleutils.c:get_name_for_var_field|RTEKind =====
-- Field selection on a RECORD-typed Var: RTE_SUBQUERY / RTE_JOIN / RTE_CTE are
-- the live arms; RTE_VALUES / RTE_FUNCTION / RTE_GROUP columns of type RECORD
-- are rejected by the parser before any deparse.
CREATE VIEW wv_field1 AS SELECT (s.r).f1 AS f FROM (SELECT ROW(1, 2) AS r) s;
SELECT pg_get_viewdef('wv_field1'::regclass);
           pg_get_viewdef            
-------------------------------------
  SELECT (r).f1 AS f                +
    FROM ( SELECT ROW(1, 2) AS r) s;
(1 row)

CREATE VIEW wv_field2 AS SELECT (j.r).f2 AS f FROM ((SELECT ROW(1, 2) AS r, 1 AS k) a JOIN (SELECT 1 AS k) b USING (k)) j;
SELECT pg_get_viewdef('wv_field2'::regclass);
               pg_get_viewdef               
--------------------------------------------
  SELECT (j.r).f2 AS f                     +
    FROM (( SELECT ROW(1, 2) AS r,         +
             1 AS k) a                     +
      JOIN ( SELECT 1 AS k) b USING (k)) j;
(1 row)

CREATE VIEW wv_field3 AS WITH c AS (SELECT ROW(3, 4) AS r) SELECT (c.r).f1 AS f FROM c;
SELECT pg_get_viewdef('wv_field3'::regclass);
         pg_get_viewdef         
--------------------------------
  WITH c AS (                  +
          SELECT ROW(3, 4) AS r+
         )                     +
  SELECT (r).f1 AS f           +
    FROM c;
(1 row)

CREATE VIEW wv_field4 AS SELECT (s.r).f1 AS f FROM (SELECT ROW(id, x) AS r FROM wa) s GROUP BY s.r;
SELECT pg_get_viewdef('wv_field4'::regclass);
             pg_get_viewdef             
----------------------------------------
  SELECT (r).f1 AS f                   +
    FROM ( SELECT ROW(wa.id, wa.x) AS r+
            FROM wa) s                 +
   GROUP BY r;
(1 row)

SELECT * FROM wv_field4 ORDER BY 1 LIMIT 2;
 f 
---
 1
 2
(2 rows)

CREATE VIEW wv_field_values AS SELECT (v.r).f1 FROM (VALUES (ROW(1, 2))) v(r);
ERROR:  42809: record type has not been registered
CREATE VIEW wv_field_func AS SELECT (f.r).f1 FROM (SELECT ROW(1, 2) AS r) f, LATERAL (SELECT f.r AS q) g;
SELECT pg_get_viewdef('wv_field_func'::regclass);
           pg_get_viewdef            
-------------------------------------
  SELECT (f.r).f1 AS f1             +
    FROM ( SELECT ROW(1, 2) AS r) f,+
     LATERAL ( SELECT f.r AS q) g;
(1 row)

-- ===== src/backend/optimizer/prep/prepjointree.c:replace_vars_in_jointree|RTEKind =====
-- lateral references into a pulled-up subquery; the missing arms are RTE kinds
-- that can never be flagged LATERAL.
SELECT * FROM (SELECT id, x FROM wa WHERE id < 3) s, LATERAL (SELECT s.x + 1 AS y) t ORDER BY 1;
 id | x | y 
----+---+---
  1 | 1 | 2
  2 | 2 | 3
(2 rows)

SELECT * FROM (SELECT id FROM wa WHERE id < 3) s, LATERAL generate_series(1, s.id) g ORDER BY 1, 2;
 id | g 
----+---
  1 | 1
  2 | 1
  2 | 2
(3 rows)

SELECT * FROM (SELECT id FROM wa WHERE id < 3) s LEFT JOIN LATERAL (SELECT wb.y FROM wb WHERE wb.id = s.id) t ON true ORDER BY 1;
 id | y 
----+---
  1 | 1
  2 | 2
(2 rows)

WITH c AS (SELECT 1 AS k) SELECT * FROM (SELECT id FROM wa WHERE id < 2) s, LATERAL (SELECT s.id AS sid, k FROM c) t;
 id | sid | k 
----+-----+---
  1 |   1 | 1
(1 row)

SELECT * FROM (SELECT id FROM wa WHERE id < 3) s, LATERAL (SELECT s.id AS sid FROM (VALUES (1)) v) t ORDER BY 1;
 id | sid 
----+-----
  1 |   1
  2 |   2
(2 rows)

EXPLAIN (COSTS OFF) SELECT * FROM (SELECT id FROM wa WHERE id < 3) s LEFT JOIN LATERAL (SELECT wb.y FROM wb WHERE wb.id = s.id) t ON true;
                   QUERY PLAN                    
-------------------------------------------------
 Hash Right Join
   Hash Cond: (wb.id = wa.id)
   ->  Seq Scan on wb
   ->  Hash
         ->  Index Only Scan using wa_pkey on wa
               Index Cond: (id < 3)
(6 rows)

-- ===== src/backend/parser/parse_target.c:FigureColnameInternal|SubLinkType =====
SELECT (SELECT 1), EXISTS(SELECT 1), 1 = ANY(SELECT 1), 1 < ALL(SELECT 2), ARRAY(SELECT 1), 1 IN (SELECT 1), (1, 2) < (SELECT 1, 2), (1, 2) = (SELECT 1, 2);
 ?column? | exists | ?column? | ?column? | array | ?column? | ?column? | ?column? 
----------+--------+----------+----------+-------+----------+----------+----------
        1 | t      | t        | t        | {1}   | t        | f        | t
(1 row)

CREATE VIEW wv_colnames AS SELECT (SELECT 1), EXISTS(SELECT 1), 1 = ANY(SELECT 1), 1 < ALL(SELECT 2), ARRAY(SELECT 1), 1 IN (SELECT 1), (1, 2) < (SELECT 1, 2);
ERROR:  42701: column "?column?" specified more than once
SELECT attname FROM pg_attribute WHERE attrelid = 'wv_colnames'::regclass AND attnum > 0 ORDER BY attnum;
ERROR:  42P01: relation "wv_colnames" does not exist
LINE 1: SELECT attname FROM pg_attribute WHERE attrelid = 'wv_colnam...
                                                          ^
-- ===== src/backend/executor/nodeAgg.c:ExecAgg|AggStrategy =====
SELECT count(*), sum(x) FROM wa;
 count | sum  
-------+------
  1000 | 4500
(1 row)

EXPLAIN (COSTS OFF) SELECT count(*), sum(x) FROM wa;
      QUERY PLAN      
----------------------
 Aggregate
   ->  Seq Scan on wa
(2 rows)

SET enable_hashagg = off;
SELECT x, count(*) FROM wa GROUP BY x ORDER BY x;
 x | count 
---+-------
 0 |   100
 1 |   100
 2 |   100
 3 |   100
 4 |   100
 5 |   100
 6 |   100
 7 |   100
 8 |   100
 9 |   100
(10 rows)

EXPLAIN (COSTS OFF) SELECT x, count(*) FROM wa GROUP BY x ORDER BY x;
               QUERY PLAN               
----------------------------------------
 GroupAggregate
   Group Key: x
   ->  Index Only Scan using wa_x on wa
(3 rows)

RESET enable_hashagg;
SET work_mem = '64kB';
EXPLAIN (COSTS OFF) SELECT x, b, v, count(*) FROM wa GROUP BY GROUPING SETS (ROLLUP (x, b), (v), ()) ORDER BY 1, 2, 3, 4;
           QUERY PLAN            
---------------------------------
 Sort
   Sort Key: x, b, v, (count(*))
   ->  MixedAggregate
         Hash Key: x, b
         Hash Key: x
         Hash Key: v
         Group Key: ()
         Group Key: ()
         ->  Seq Scan on wa
(9 rows)

SELECT x, b, v, count(*) FROM wa GROUP BY GROUPING SETS (ROLLUP (x, b), (v), ()) ORDER BY 1, 2, 3, 4;
 x | b | v  | count 
---+---+----+-------
 0 | t |    |   100
 0 |   |    |   100
 1 | f |    |   100
 1 |   |    |   100
 2 | t |    |   100
 2 |   |    |   100
 3 | f |    |   100
 3 |   |    |   100
 4 | t |    |   100
 4 |   |    |   100
 5 | f |    |   100
 5 |   |    |   100
 6 | t |    |   100
 6 |   |    |   100
 7 | f |    |   100
 7 |   |    |   100
 8 | t |    |   100
 8 |   |    |   100
 9 | f |    |   100
 9 |   |    |   100
   |   | v0 |   200
   |   | v1 |   200
   |   | v2 |   200
   |   | v3 |   200
   |   | v4 |   200
   |   |    |  1000
   |   |    |  1000
(27 rows)

RESET work_mem;
EXPLAIN (COSTS OFF) SELECT x, b, count(*) FROM wa GROUP BY GROUPING SETS ((x), (b), ()) ORDER BY 1, 2, 3;
          QUERY PLAN          
------------------------------
 Sort
   Sort Key: x, b, (count(*))
   ->  MixedAggregate
         Hash Key: x
         Hash Key: b
         Group Key: ()
         ->  Seq Scan on wa
(7 rows)

SELECT x, b, count(*) FROM wa GROUP BY GROUPING SETS ((x), (b), ()) ORDER BY 1, 2, 3;
 x | b | count 
---+---+-------
 0 |   |   100
 1 |   |   100
 2 |   |   100
 3 |   |   100
 4 |   |   100
 5 |   |   100
 6 |   |   100
 7 |   |   100
 8 |   |   100
 9 |   |   100
   | f |   500
   | t |   500
   |   |  1000
(13 rows)

-- ===== src/backend/optimizer/prep/prepjointree.c:pull_up_simple_subquery|RTEKind =====
-- a LATERAL subquery over a transition table is pulled up; its child ENR RTE
-- takes the "can't contain lateral references" arm.
CREATE TABLE tt_base (id int, n int);
INSERT INTO tt_base VALUES (1, 10), (2, 20);
CREATE TABLE tt (id int);
CREATE FUNCTION tt_trg() RETURNS trigger LANGUAGE plpgsql AS $$
DECLARE r record;
BEGIN
  FOR r IN SELECT b.id, s.nid FROM tt_base b, LATERAL (SELECT nt.id AS nid FROM nt WHERE nt.id = b.id) s ORDER BY 1 LOOP
    RAISE NOTICE 'lateral enr: % %', r.id, r.nid;
  END LOOP;
  FOR r IN SELECT count(*) AS c FROM (SELECT * FROM nt) s LOOP
    RAISE NOTICE 'pulled-up enr count: %', r.c;
  END LOOP;
  FOR r IN EXECUTE 'EXPLAIN (COSTS OFF) SELECT * FROM nt' LOOP
    RAISE NOTICE 'plan: %', r."QUERY PLAN";
  END LOOP;
  FOR r IN EXECUTE 'EXPLAIN (VERBOSE, COSTS OFF) SELECT * FROM (SELECT * FROM nt) s' LOOP
    RAISE NOTICE 'plan: %', r."QUERY PLAN";
  END LOOP;
  BEGIN
    CREATE VIEW tt_enr_view AS SELECT * FROM nt;
  EXCEPTION WHEN OTHERS THEN
    RAISE NOTICE 'view over enr: % %', SQLSTATE, SQLERRM;
  END;
  RETURN NULL;
END $$;
CREATE TRIGGER tt_ai AFTER INSERT ON tt REFERENCING NEW TABLE AS nt FOR EACH STATEMENT EXECUTE FUNCTION tt_trg();
SET client_min_messages = notice;
INSERT INTO tt VALUES (1), (2), (3);
NOTICE:  00000: lateral enr: 1 1
NOTICE:  00000: lateral enr: 2 2
NOTICE:  00000: pulled-up enr count: 3
NOTICE:  00000: plan: Named Tuplestore Scan
NOTICE:  00000: plan: Named Tuplestore Scan
NOTICE:  00000: plan:   Output: nt.id
NOTICE:  00000: view over enr: 42P01 relation "nt" does not exist
SET client_min_messages = warning;
-- ===== src/backend/optimizer/plan/createplan.c:create_plan_recurse|NodeTag =====
-- ===== src/backend/optimizer/plan/createplan.c:create_join_plan|NodeTag =====
-- one plan shape per pathtype arm (CustomScan is UNPORTED).
EXPLAIN (COSTS OFF) SELECT count(*) FROM wa;
      QUERY PLAN      
----------------------
 Aggregate
   ->  Seq Scan on wa
(2 rows)

EXPLAIN (COSTS OFF) SELECT id FROM wa WHERE id < 3 UNION ALL SELECT id FROM wb WHERE id < 3;
                QUERY PLAN                 
-------------------------------------------
 Append
   ->  Index Only Scan using wa_pkey on wa
         Index Cond: (id < 3)
   ->  Index Only Scan using wb_pkey on wb
         Index Cond: (id < 3)
(5 rows)

SET enable_seqscan = off;
EXPLAIN (COSTS OFF) SELECT * FROM wa WHERE x = 3 OR x = 5;
                     QUERY PLAN                     
----------------------------------------------------
 Bitmap Heap Scan on wa
   Recheck Cond: ((x = 3) OR (x = 5))
   ->  Bitmap Index Scan on wa_x
         Index Cond: (x = ANY ('{3,5}'::integer[]))
(4 rows)

EXPLAIN (COSTS OFF) SELECT * FROM wa ORDER BY x, id;
            QUERY PLAN             
-----------------------------------
 Incremental Sort
   Sort Key: x, id
   Presorted Key: x
   ->  Index Scan using wa_x on wa
(4 rows)

EXPLAIN (COSTS OFF) SELECT id FROM wa WHERE id < 5;
             QUERY PLAN              
-------------------------------------
 Index Only Scan using wa_pkey on wa
   Index Cond: (id < 5)
(2 rows)

EXPLAIN (COSTS OFF) SELECT * FROM wa WHERE id = 5;
           QUERY PLAN           
--------------------------------
 Index Scan using wa_pkey on wa
   Index Cond: (id = 5)
(2 rows)

EXPLAIN (COSTS OFF) SELECT id FROM wa UNION ALL SELECT id FROM wb ORDER BY id;
                QUERY PLAN                 
-------------------------------------------
 Merge Append
   Sort Key: wa.id
   ->  Index Only Scan using wa_pkey on wa
   ->  Index Only Scan using wb_pkey on wb
(4 rows)

RESET enable_seqscan;
EXPLAIN (COSTS OFF) SELECT * FROM wa LIMIT 1;
      QUERY PLAN      
----------------------
 Limit
   ->  Seq Scan on wa
(2 rows)

EXPLAIN (COSTS OFF) SELECT * FROM wa WHERE id = 1 FOR UPDATE;
              QUERY PLAN              
--------------------------------------
 LockRows
   ->  Index Scan using wa_pkey on wa
         Index Cond: (id = 1)
(3 rows)

SET enable_hashjoin = off; SET enable_mergejoin = off;
EXPLAIN (COSTS OFF) SELECT * FROM wa, wb WHERE wa.x = wb.y;
               QUERY PLAN                
-----------------------------------------
 Nested Loop
   ->  Seq Scan on wb
   ->  Memoize
         Cache Key: wb.y
         Cache Mode: logical
         ->  Index Scan using wa_x on wa
               Index Cond: (x = wb.y)
(7 rows)

EXPLAIN (COSTS OFF) SELECT * FROM wb JOIN wa ON wa.x = wb.y WHERE wb.id < 100;
               QUERY PLAN                
-----------------------------------------
 Nested Loop
   ->  Seq Scan on wb
         Filter: (id < 100)
   ->  Memoize
         Cache Key: wb.y
         Cache Mode: logical
         ->  Index Scan using wa_x on wa
               Index Cond: (x = wb.y)
(8 rows)

EXPLAIN (COSTS OFF) SELECT * FROM wb JOIN wa ON wa.id = wb.id;
              QUERY PLAN              
--------------------------------------
 Nested Loop
   ->  Seq Scan on wb
   ->  Index Scan using wa_pkey on wa
         Index Cond: (id = wb.id)
(4 rows)

RESET enable_hashjoin; RESET enable_mergejoin;
SET enable_hashjoin = off; SET enable_nestloop = off;
EXPLAIN (COSTS OFF) SELECT * FROM wb JOIN wa ON wa.id = wb.id;
              QUERY PLAN              
--------------------------------------
 Merge Join
   Merge Cond: (wb.id = wa.id)
   ->  Index Scan using wb_pkey on wb
   ->  Index Scan using wa_pkey on wa
(4 rows)

RESET enable_hashjoin; RESET enable_nestloop;
EXPLAIN (COSTS OFF) SELECT * FROM wb JOIN wa ON wa.id = wb.id;
          QUERY PLAN          
------------------------------
 Hash Join
   Hash Cond: (wa.id = wb.id)
   ->  Seq Scan on wa
   ->  Hash
         ->  Seq Scan on wb
(5 rows)

EXPLAIN (COSTS OFF) UPDATE wa SET x = x + 1 WHERE id = 1;
              QUERY PLAN              
--------------------------------------
 Update on wa
   ->  Index Scan using wa_pkey on wa
         Index Cond: (id = 1)
(3 rows)

EXPLAIN (COSTS OFF) SELECT generate_series(1, 3);
  QUERY PLAN  
--------------
 ProjectSet
   ->  Result
(2 rows)

EXPLAIN (COSTS OFF) WITH RECURSIVE r(n) AS (SELECT 1 UNION ALL SELECT n + 1 FROM r WHERE n < 5) SELECT * FROM r;
              QUERY PLAN               
---------------------------------------
 CTE Scan on r
   CTE r
     ->  Recursive Union
           ->  Result
           ->  WorkTable Scan on r r_1
                 Filter: (n < 5)
(6 rows)

EXPLAIN (COSTS OFF) SELECT id FROM wa INTERSECT SELECT id FROM wb;
      QUERY PLAN      
----------------------
 HashSetOp Intersect
   ->  Seq Scan on wb
   ->  Seq Scan on wa
(3 rows)

EXPLAIN (COSTS OFF) SELECT id FROM wa EXCEPT ALL SELECT id FROM wb;
      QUERY PLAN      
----------------------
 HashSetOp Except All
   ->  Seq Scan on wa
   ->  Seq Scan on wb
(3 rows)

EXPLAIN (COSTS OFF) SELECT * FROM wa ORDER BY t;
      QUERY PLAN      
----------------------
 Sort
   Sort Key: t
   ->  Seq Scan on wa
(3 rows)

EXPLAIN (COSTS OFF) SELECT * FROM (SELECT id, random() AS r FROM wa) s WHERE s.id < 3;
             QUERY PLAN              
-------------------------------------
 Index Only Scan using wa_pkey on wa
   Index Cond: (id < 3)
(2 rows)

EXPLAIN (COSTS OFF) SELECT * FROM wa WHERE ctid >= '(0,1)' AND ctid < '(1,1)';
                           QUERY PLAN                           
----------------------------------------------------------------
 Tid Range Scan on wa
   TID Cond: ((ctid >= '(0,1)'::tid) AND (ctid < '(1,1)'::tid))
(2 rows)

EXPLAIN (COSTS OFF) SELECT * FROM wa WHERE ctid = '(0,1)';
            QUERY PLAN             
-----------------------------------
 Tid Scan on wa
   TID Cond: (ctid = '(0,1)'::tid)
(2 rows)

SET enable_hashagg = off;
EXPLAIN (COSTS OFF) SELECT DISTINCT x FROM wa;
               QUERY PLAN               
----------------------------------------
 Unique
   ->  Index Only Scan using wa_x on wa
(2 rows)

EXPLAIN (COSTS OFF) SELECT x FROM wa GROUP BY x;
               QUERY PLAN               
----------------------------------------
 Group
   Group Key: x
   ->  Index Only Scan using wa_x on wa
(3 rows)

RESET enable_hashagg;
EXPLAIN (COSTS OFF) SELECT rank() OVER (ORDER BY x) FROM wa LIMIT 1;
                         QUERY PLAN                          
-------------------------------------------------------------
 Limit
   ->  WindowAgg
         Window: w1 AS (ORDER BY x ROWS UNBOUNDED PRECEDING)
         ->  Index Only Scan using wa_x on wa
(4 rows)

SET parallel_setup_cost = 0; SET parallel_tuple_cost = 0; SET min_parallel_table_scan_size = 0; SET min_parallel_index_scan_size = 0;
SET max_parallel_workers_per_gather = 2;
EXPLAIN (COSTS OFF) SELECT count(*) FROM wa;
                QUERY PLAN                 
-------------------------------------------
 Finalize Aggregate
   ->  Gather
         Workers Planned: 2
         ->  Partial Aggregate
               ->  Parallel Seq Scan on wa
(5 rows)

EXPLAIN (COSTS OFF) SELECT * FROM wa ORDER BY x;
             QUERY PLAN              
-------------------------------------
 Gather Merge
   Workers Planned: 2
   ->  Sort
         Sort Key: x
         ->  Parallel Seq Scan on wa
(5 rows)

SELECT count(*) FROM wa;
 count 
-------
  1000
(1 row)

SET max_parallel_workers_per_gather = 0;
-- ===== src/backend/executor/execExpr.c:ExecInitExprRec|NodeTag (AggState/WindowAggState) =====
SELECT sum(x), count(DISTINCT b), string_agg(v, ',' ORDER BY v) FILTER (WHERE id < 3) FROM wa;
 sum  | count | string_agg 
------+-------+------------
 4500 |     2 | v1,v2
(1 row)

SELECT id, rank() OVER (ORDER BY x), sum(x) OVER (PARTITION BY b ORDER BY id ROWS 1 PRECEDING) FROM wa WHERE id < 5 ORDER BY id;
 id | rank | sum 
----+------+-----
  1 |    1 |   1
  2 |    2 |   2
  3 |    3 |   4
  4 |    4 |   6
(4 rows)

SELECT x, sum(id), rank() OVER (ORDER BY sum(id)) FROM wa GROUP BY x ORDER BY x LIMIT 3;
 x |  sum  | rank 
---+-------+------
 0 | 50500 |   10
 1 | 49600 |    1
 2 | 49700 |    2
(3 rows)

-- ===== src/backend/nodes/nodeFuncs.c:expression_tree_walker_impl|NodeTag (IndexClause/PlaceHolderInfo) =====
-- ===== src/backend/nodes/nodeFuncs.c:expression_tree_mutator_impl|NodeTag (IndexClause/PlaceHolderInfo) =====
EXPLAIN (VERBOSE, COSTS OFF) SELECT * FROM wa LEFT JOIN (SELECT id, 1 AS one FROM wb) s ON wa.id = s.id WHERE s.one IS NULL AND wa.id < 5;
                     QUERY PLAN                      
-----------------------------------------------------
 Hash Right Join
   Output: wa.id, wa.x, wa.b, wa.v, wa.t, wb.id, (1)
   Inner Unique: true
   Hash Cond: (wb.id = wa.id)
   Filter: ((1) IS NULL)
   ->  Seq Scan on public.wb
         Output: wb.id, 1
   ->  Hash
         Output: wa.id, wa.x, wa.b, wa.v, wa.t
         ->  Index Scan using wa_pkey on public.wa
               Output: wa.id, wa.x, wa.b, wa.v, wa.t
               Index Cond: (wa.id < 5)
(12 rows)

SELECT * FROM wa LEFT JOIN (SELECT id, 1 AS one FROM wb) s ON wa.id = s.id WHERE s.one IS NULL ORDER BY wa.id LIMIT 3;
 id  | x | b | v  |  t   | id | one 
-----+---+---+----+------+----+-----
 501 | 1 | f | v1 | t501 |    |    
 502 | 2 | t | v2 | t502 |    |    
 503 | 3 | f | v3 | t503 |    |    
(3 rows)

SELECT wa.id, s.one FROM wa LEFT JOIN (SELECT id, 1 AS one FROM wb) s ON wa.id = s.id WHERE wa.id IN (1, 501) ORDER BY 1;
 id  | one 
-----+-----
   1 |   1
 501 |    
(2 rows)

EXPLAIN (VERBOSE, COSTS OFF) SELECT wa.id, s.one FROM wa LEFT JOIN (SELECT id, 1 AS one FROM wb) s ON wa.id = s.id WHERE wa.id IN (1, 501);
                        QUERY PLAN                        
----------------------------------------------------------
 Nested Loop Left Join
   Output: wa.id, (1)
   Inner Unique: true
   ->  Index Only Scan using wa_pkey on public.wa
         Output: wa.id
         Index Cond: (wa.id = ANY ('{1,501}'::integer[]))
   ->  Index Only Scan using wb_pkey on public.wb
         Output: wb.id, 1
         Index Cond: (wb.id = wa.id)
(9 rows)

EXPLAIN (COSTS OFF) SELECT * FROM wa WHERE id = 5 AND x = 5;
           QUERY PLAN           
--------------------------------
 Index Scan using wa_pkey on wa
   Index Cond: (id = 5)
   Filter: (x = 5)
(3 rows)

EXPLAIN (COSTS OFF) SELECT * FROM wa WHERE v LIKE 'v1%' AND id < 10;
              QUERY PLAN              
--------------------------------------
 Index Scan using wa_pkey on wa
   Index Cond: (id < 10)
   Filter: ((v)::text ~~ 'v1%'::text)
(3 rows)

EXPLAIN (VERBOSE, COSTS OFF) SELECT * FROM wa WHERE id = ANY (ARRAY[1, 2, 3]);
                     QUERY PLAN                     
----------------------------------------------------
 Index Scan using wa_pkey on public.wa
   Output: id, x, b, v, t
   Index Cond: (wa.id = ANY ('{1,2,3}'::integer[]))
(3 rows)

-- ===== src/backend/optimizer/path/allpaths.c:set_rel_consider_parallel|RTEKind (RTE_GROUP/RTE_JOIN) =====
SET max_parallel_workers_per_gather = 2;
EXPLAIN (COSTS OFF) SELECT wa.x, count(*) FROM wa JOIN wb ON wa.id = wb.id GROUP BY wa.x;
                      QUERY PLAN                       
-------------------------------------------------------
 Finalize HashAggregate
   Group Key: wa.x
   ->  Gather
         Workers Planned: 2
         ->  Partial HashAggregate
               Group Key: wa.x
               ->  Parallel Hash Join
                     Hash Cond: (wa.id = wb.id)
                     ->  Parallel Seq Scan on wa
                     ->  Parallel Hash
                           ->  Parallel Seq Scan on wb
(11 rows)

SELECT wa.x, count(*) FROM wa JOIN wb ON wa.id = wb.id GROUP BY wa.x ORDER BY 1;
 x | count 
---+-------
 0 |    50
 1 |    50
 2 |    50
 3 |    50
 4 |    50
 5 |    50
 6 |    50
 7 |    50
 8 |    50
 9 |    50
(10 rows)

EXPLAIN (COSTS OFF) SELECT s.x, count(*) FROM (SELECT x FROM wa GROUP BY x) s JOIN wb ON s.x = wb.y GROUP BY s.x;
                         QUERY PLAN                          
-------------------------------------------------------------
 HashAggregate
   Group Key: wa.x
   ->  Hash Join
         Hash Cond: (wb.y = wa.x)
         ->  Gather
               Workers Planned: 2
               ->  Parallel Seq Scan on wb
         ->  Hash
               ->  Finalize HashAggregate
                     Group Key: wa.x
                     ->  Gather
                           Workers Planned: 2
                           ->  Partial HashAggregate
                                 Group Key: wa.x
                                 ->  Parallel Seq Scan on wa
(15 rows)

SET max_parallel_workers_per_gather = 0;
-- ===== src/backend/optimizer/path/costsize.c:cost_qual_eval_walker|NodeTag (RestrictInfo) =====
EXPLAIN SELECT * FROM wa JOIN wb ON wa.id = wb.id WHERE wa.x > 5;
                                   QUERY PLAN                                    
---------------------------------------------------------------------------------
 Hash Join  (cost=24.25..33.56 rows=200 width=24)
   Hash Cond: (wb.id = wa.id)
   ->  Seq Scan on wb  (cost=0.00..8.00 rows=500 width=8)
   ->  Hash  (cost=19.25..19.25 rows=400 width=16)
         ->  Bitmap Heap Scan on wa  (cost=7.25..19.25 rows=400 width=16)
               Recheck Cond: (x > 5)
               ->  Bitmap Index Scan on wa_x  (cost=0.00..7.15 rows=400 width=0)
                     Index Cond: (x > 5)
(8 rows)

EXPLAIN SELECT * FROM wa WHERE x > 5 AND t <> 'zz' AND (b OR v = 'v1');
                             QUERY PLAN                              
---------------------------------------------------------------------
 Bitmap Heap Scan on wa  (cost=7.21..21.21 rows=240 width=16)
   Recheck Cond: (x > 5)
   Filter: ((t <> 'zz'::text) AND (b OR ((v)::text = 'v1'::text)))
   ->  Bitmap Index Scan on wa_x  (cost=0.00..7.15 rows=400 width=0)
         Index Cond: (x > 5)
(5 rows)

EXPLAIN SELECT * FROM wa LEFT JOIN wb ON wa.id = wb.id AND wb.y > 2 WHERE wa.x = 1;
                                   QUERY PLAN                                    
---------------------------------------------------------------------------------
 Hash Right Join  (cost=14.43..24.42 rows=100 width=24)
   Hash Cond: (wb.id = wa.id)
   ->  Seq Scan on wb  (cost=0.00..9.25 rows=285 width=8)
         Filter: (y > 2)
   ->  Hash  (cost=13.18..13.18 rows=100 width=16)
         ->  Bitmap Heap Scan on wa  (cost=4.93..13.18 rows=100 width=16)
               Recheck Cond: (x = 1)
               ->  Bitmap Index Scan on wa_x  (cost=0.00..4.90 rows=100 width=0)
                     Index Cond: (x = 1)
(9 rows)

-- ===== src/backend/parser/parse_clause.c:transformFromClauseItem|NodeTag (JoinExpr) =====
SELECT count(*) FROM (wa JOIN wb ON wa.id = wb.id) JOIN wa w2 ON w2.id = wb.id;
 count 
-------
   500
(1 row)

SELECT count(*) FROM wa CROSS JOIN (wb JOIN wa w3 USING (id)) WHERE wa.id < 3;
 count 
-------
  1000
(1 row)

SELECT * FROM (wa JOIN wb USING (id)) AS j(a, b, c, d, e, f) ORDER BY a LIMIT 2;
 a | b | c | d  | e  | f 
---+---+---+----+----+---
 1 | 1 | f | v1 | t1 | 1
 2 | 2 | t | v2 | t2 | 2
(2 rows)

SELECT * FROM ((SELECT 1 AS k, 'x' AS s) a NATURAL JOIN (SELECT 1 AS k, 'y' AS u) b) j;
 k | s | u 
---+---+---
 1 | x | y
(1 row)

SELECT * FROM wa JOIN (wb JOIN (SELECT 1 AS id) s ON s.id = wb.id) ON wa.id = wb.id;
 id | x | b | v  | t  | id | y | id 
----+---+---+----+----+----+---+----
  1 | 1 | f | v1 | t1 |  1 | 1 |  1
(1 row)

SELECT * FROM (wa AS w1 JOIN wb AS w2 ON w1.id = w2.id) AS jj(id, x, b, v, t, id2, y) WHERE jj.id = 2;
 id | x | b | v  | t  | id2 | y 
----+---+---+----+----+-----+---
  2 | 2 | t | v2 | t2 |   2 | 2
(1 row)

-- ===== src/backend/utils/adt/selfuncs.c:index_other_operands_eval_cost|NodeTag (RestrictInfo) =====
EXPLAIN SELECT * FROM wa WHERE id = (SELECT max(id) FROM wb);
                                               QUERY PLAN                                                
---------------------------------------------------------------------------------------------------------
 Index Scan using wa_pkey on wa  (cost=0.60..8.62 rows=1 width=16)
   Index Cond: (id = (InitPlan 2).col1)
   InitPlan 2
     ->  Result  (cost=0.32..0.33 rows=1 width=4)
           InitPlan 1
             ->  Limit  (cost=0.27..0.32 rows=1 width=4)
                   ->  Index Only Scan Backward using wb_pkey on wb  (cost=0.27..23.77 rows=500 width=4)
(7 rows)

EXPLAIN SELECT * FROM wa WHERE id = length('abc' || 'd');
                            QUERY PLAN                             
-------------------------------------------------------------------
 Index Scan using wa_pkey on wa  (cost=0.28..8.29 rows=1 width=16)
   Index Cond: (id = 4)
(2 rows)

SET enable_hashjoin = off; SET enable_mergejoin = off;
EXPLAIN SELECT * FROM wb JOIN wa ON wa.id = wb.id + 1 WHERE wb.id < 10;
                                 QUERY PLAN                                 
----------------------------------------------------------------------------
 Nested Loop  (cost=4.62..54.12 rows=9 width=24)
   ->  Bitmap Heap Scan on wb  (cost=4.34..7.45 rows=9 width=8)
         Recheck Cond: (id < 10)
         ->  Bitmap Index Scan on wb_pkey  (cost=0.00..4.34 rows=9 width=0)
               Index Cond: (id < 10)
   ->  Index Scan using wa_pkey on wa  (cost=0.28..5.18 rows=1 width=16)
         Index Cond: (id = (wb.id + 1))
(7 rows)

RESET enable_hashjoin; RESET enable_mergejoin;
EXPLAIN SELECT * FROM wa WHERE x = 3 AND id IN (SELECT id FROM wb WHERE y = 1);
                                QUERY PLAN                                 
---------------------------------------------------------------------------
 Hash Join  (cost=15.08..23.59 rows=7 width=16)
   Hash Cond: (wa.id = wb.id)
   ->  Bitmap Heap Scan on wa  (cost=4.93..13.18 rows=100 width=16)
         Recheck Cond: (x = 3)
         ->  Bitmap Index Scan on wa_x  (cost=0.00..4.90 rows=100 width=0)
               Index Cond: (x = 3)
   ->  Hash  (cost=9.25..9.25 rows=72 width=4)
         ->  Seq Scan on wb  (cost=0.00..9.25 rows=72 width=4)
               Filter: (y = 1)
(9 rows)

-- ===== src/backend/commands/explain.c:ExplainTargetRel|NodeTag =====
EXPLAIN (COSTS OFF) INSERT INTO wa VALUES (2000, 1, true, 'v', 't');
  QUERY PLAN  
--------------
 Insert on wa
   ->  Result
(2 rows)

EXPLAIN (VERBOSE, COSTS OFF) UPDATE wa SET x = 1 WHERE id = 1;
                 QUERY PLAN                  
---------------------------------------------
 Update on public.wa
   ->  Index Scan using wa_pkey on public.wa
         Output: 1, ctid
         Index Cond: (wa.id = 1)
(4 rows)

EXPLAIN (COSTS OFF) DELETE FROM wa WHERE id = 1;
              QUERY PLAN              
--------------------------------------
 Delete on wa
   ->  Index Scan using wa_pkey on wa
         Index Cond: (id = 1)
(3 rows)

EXPLAIN (COSTS OFF) MERGE INTO wa USING wb ON wa.id = wb.id WHEN MATCHED THEN UPDATE SET x = wb.y WHEN NOT MATCHED THEN INSERT VALUES (wb.id, wb.y, true, 'v', 't');
             QUERY PLAN             
------------------------------------
 Merge on wa
   ->  Hash Right Join
         Hash Cond: (wa.id = wb.id)
         ->  Seq Scan on wa
         ->  Hash
               ->  Seq Scan on wb
(6 rows)

EXPLAIN (VERBOSE, COSTS OFF) SELECT * FROM wa TABLESAMPLE SYSTEM (50) WHERE id = 1;
           QUERY PLAN            
---------------------------------
 Sample Scan on public.wa
   Output: id, x, b, v, t
   Sampling: system ('50'::real)
   Filter: (wa.id = 1)
(4 rows)

EXPLAIN (VERBOSE, COSTS OFF) SELECT * FROM wa WHERE ctid = '(0,1)';
              QUERY PLAN              
--------------------------------------
 Tid Scan on public.wa
   Output: id, x, b, v, t
   TID Cond: (wa.ctid = '(0,1)'::tid)
(3 rows)

EXPLAIN (VERBOSE, COSTS OFF) SELECT * FROM wa WHERE ctid > '(0,1)';
             QUERY PLAN             
------------------------------------
 Seq Scan on public.wa
   Output: id, x, b, v, t
   Filter: (wa.ctid > '(0,1)'::tid)
(3 rows)

EXPLAIN (VERBOSE, COSTS OFF) SELECT * FROM generate_series(1, 2) AS g(i);
                  QUERY PLAN                   
-----------------------------------------------
 Function Scan on pg_catalog.generate_series g
   Output: i
   Function Call: generate_series(1, 2)
(3 rows)

EXPLAIN (VERBOSE, COSTS OFF) SELECT * FROM (VALUES (1, 'a'), (2, 'b')) AS v(i, s);
                    QUERY PLAN                    
--------------------------------------------------
 Values Scan on "*VALUES*"
   Output: "*VALUES*".column1, "*VALUES*".column2
(2 rows)

EXPLAIN (VERBOSE, COSTS OFF) WITH c AS MATERIALIZED (SELECT id FROM wa WHERE id < 3) SELECT * FROM c c1, c c2;
                     QUERY PLAN                     
----------------------------------------------------
 Nested Loop
   Output: c1.id, c2.id
   CTE c
     ->  Index Only Scan using wa_pkey on public.wa
           Output: wa.id
           Index Cond: (wa.id < 3)
   ->  CTE Scan on c c1
         Output: c1.id
   ->  CTE Scan on c c2
         Output: c2.id
(10 rows)

EXPLAIN (VERBOSE, COSTS OFF) WITH RECURSIVE r(n) AS (SELECT 1 UNION ALL SELECT n + 1 FROM r WHERE n < 5) SELECT * FROM r;
              QUERY PLAN               
---------------------------------------
 CTE Scan on r
   Output: r.n
   CTE r
     ->  Recursive Union
           ->  Result
                 Output: 1
           ->  WorkTable Scan on r r_1
                 Output: (r_1.n + 1)
                 Filter: (r_1.n < 5)
(9 rows)

EXPLAIN (VERBOSE, COSTS OFF) SELECT * FROM JSON_TABLE('[1, 2]', '$[*]' COLUMNS (a int PATH '$')) jt;
                                                  QUERY PLAN                                                  
--------------------------------------------------------------------------------------------------------------
 Table Function Scan on "json_table" jt
   Output: a
   Table Function Call: JSON_TABLE('[1, 2]'::jsonb, '$[*]' AS json_table_path_0 COLUMNS (a integer PATH '$'))
(3 rows)

EXPLAIN (VERBOSE, COSTS OFF) SELECT * FROM XMLTABLE('/r/e' PASSING '<r><e>1</e></r>' COLUMNS a int PATH '.') xt;
                                                     QUERY PLAN                                                      
---------------------------------------------------------------------------------------------------------------------
 Table Function Scan on "xmltable" xt
   Output: a
   Table Function Call: XMLTABLE(('/r/e'::text) PASSING ('<r><e>1</e></r>'::xml) COLUMNS a integer PATH ('.'::text))
(3 rows)

SET enable_seqscan = off;
EXPLAIN (VERBOSE, COSTS OFF) SELECT * FROM wa WHERE x = 3 OR x = 5;
                      QUERY PLAN                       
-------------------------------------------------------
 Bitmap Heap Scan on public.wa
   Output: id, x, b, v, t
   Recheck Cond: ((wa.x = 3) OR (wa.x = 5))
   ->  Bitmap Index Scan on wa_x
         Index Cond: (wa.x = ANY ('{3,5}'::integer[]))
(5 rows)

EXPLAIN (VERBOSE, COSTS OFF) SELECT id FROM wa WHERE id < 3;
                 QUERY PLAN                 
--------------------------------------------
 Index Only Scan using wa_pkey on public.wa
   Output: id
   Index Cond: (wa.id < 3)
(3 rows)

EXPLAIN (VERBOSE, COSTS OFF) SELECT * FROM wa WHERE id < 3;
              QUERY PLAN               
---------------------------------------
 Index Scan using wa_pkey on public.wa
   Output: id, x, b, v, t
   Index Cond: (wa.id < 3)
(3 rows)

RESET enable_seqscan;
-- ===== src/backend/executor/execAmi.c:ExecSupportsMarkRestore|NodeTag (GroupResultPath/MinMaxAggPath) =====
-- merge join whose inner is a Result path: C returns false, so a Materialize is
-- interposed.
SET enable_hashjoin = off; SET enable_nestloop = off;
EXPLAIN (COSTS OFF) SELECT * FROM wa JOIN (SELECT min(id) AS m FROM wb) s ON wa.id = s.m;
                          QUERY PLAN                           
---------------------------------------------------------------
 Merge Join
   Merge Cond: (wa.id = ((InitPlan 1).col1))
   ->  Index Scan using wa_pkey on wa
   ->  Sort
         Sort Key: ((InitPlan 1).col1)
         ->  Result
               InitPlan 1
                 ->  Limit
                       ->  Index Only Scan using wb_pkey on wb
(9 rows)

SELECT * FROM wa JOIN (SELECT min(id) AS m FROM wb) s ON wa.id = s.m;
 id | x | b | v  | t  | m 
----+---+---+----+----+---
  1 | 1 | f | v1 | t1 | 1
(1 row)

EXPLAIN (COSTS OFF) SELECT * FROM wa JOIN (SELECT 2 AS m GROUP BY 1) s ON wa.id = s.m;
              QUERY PLAN              
--------------------------------------
 Merge Join
   Merge Cond: (wa.id = (2))
   ->  Index Scan using wa_pkey on wa
   ->  Sort
         Sort Key: (2)
         ->  Group
               ->  Result
(7 rows)

SELECT * FROM wa JOIN (SELECT 2 AS m GROUP BY 1) s ON wa.id = s.m;
 id | x | b | v  | t  | m 
----+---+---+----+----+---
  2 | 2 | t | v2 | t2 | 2
(1 row)

EXPLAIN (COSTS OFF) SELECT * FROM (SELECT min(id) AS m FROM wb) s JOIN wa ON wa.id = s.m;
                          QUERY PLAN                           
---------------------------------------------------------------
 Merge Join
   Merge Cond: (wa.id = ((InitPlan 1).col1))
   ->  Index Scan using wa_pkey on wa
   ->  Sort
         Sort Key: ((InitPlan 1).col1)
         ->  Result
               InitPlan 1
                 ->  Limit
                       ->  Index Only Scan using wb_pkey on wb
(9 rows)

RESET enable_hashjoin; RESET enable_nestloop;
-- ===== src/backend/optimizer/path/costsize.c:has_indexed_join_quals|NodeTag =====
SET enable_hashjoin = off; SET enable_mergejoin = off;
EXPLAIN SELECT * FROM wb JOIN wa ON wa.id = wb.id WHERE wb.id < 10;
                                 QUERY PLAN                                 
----------------------------------------------------------------------------
 Nested Loop  (cost=4.62..54.10 rows=9 width=24)
   ->  Bitmap Heap Scan on wb  (cost=4.34..7.45 rows=9 width=8)
         Recheck Cond: (id < 10)
         ->  Bitmap Index Scan on wb_pkey  (cost=0.00..4.34 rows=9 width=0)
               Index Cond: (id < 10)
   ->  Index Scan using wa_pkey on wa  (cost=0.28..5.18 rows=1 width=16)
         Index Cond: (id = wb.id)
(7 rows)

EXPLAIN SELECT wa.id FROM wb JOIN wa ON wa.id = wb.id WHERE wb.id < 10;
                                 QUERY PLAN                                  
-----------------------------------------------------------------------------
 Nested Loop  (cost=0.55..27.07 rows=9 width=4)
   ->  Index Only Scan using wb_pkey on wb  (cost=0.27..4.43 rows=9 width=4)
         Index Cond: (id < 10)
   ->  Index Only Scan using wa_pkey on wa  (cost=0.28..2.51 rows=1 width=4)
         Index Cond: (id = wb.id)
(5 rows)

SET enable_indexscan = off;
EXPLAIN SELECT * FROM wb JOIN wa ON wa.x = wb.y WHERE wb.id < 3;
                                 QUERY PLAN                                 
----------------------------------------------------------------------------
 Nested Loop  (cost=9.21..35.62 rows=200 width=24)
   ->  Bitmap Heap Scan on wb  (cost=4.29..7.41 rows=2 width=8)
         Recheck Cond: (id < 3)
         ->  Bitmap Index Scan on wb_pkey  (cost=0.00..4.29 rows=2 width=0)
               Index Cond: (id < 3)
   ->  Bitmap Heap Scan on wa  (cost=4.93..13.10 rows=100 width=16)
         Recheck Cond: (x = wb.y)
         ->  Bitmap Index Scan on wa_x  (cost=0.00..4.90 rows=100 width=0)
               Index Cond: (x = wb.y)
(9 rows)

RESET enable_indexscan;
RESET enable_hashjoin; RESET enable_mergejoin;
-- ===== src/backend/optimizer/plan/createplan.c:use_physical_tlist|NodeTag (BitmapHeapPath) =====
-- ===== src/backend/optimizer/util/plancat.c:build_physical_tlist|RTEKind =====
SET enable_seqscan = off;
EXPLAIN (VERBOSE, COSTS OFF) SELECT * FROM wa WHERE x = 3 OR x = 4;
                      QUERY PLAN                       
-------------------------------------------------------
 Bitmap Heap Scan on public.wa
   Output: id, x, b, v, t
   Recheck Cond: ((wa.x = 3) OR (wa.x = 4))
   ->  Bitmap Index Scan on wa_x
         Index Cond: (wa.x = ANY ('{3,4}'::integer[]))
(5 rows)

EXPLAIN (VERBOSE, COSTS OFF) SELECT t FROM wa WHERE x = 3 OR x = 4;
                      QUERY PLAN                       
-------------------------------------------------------
 Bitmap Heap Scan on public.wa
   Output: t
   Recheck Cond: ((wa.x = 3) OR (wa.x = 4))
   ->  Bitmap Index Scan on wa_x
         Index Cond: (wa.x = ANY ('{3,4}'::integer[]))
(5 rows)

EXPLAIN (VERBOSE, COSTS OFF) SELECT * FROM wa WHERE (x = 3 OR x = 4) AND t LIKE 't1%';
                      QUERY PLAN                       
-------------------------------------------------------
 Bitmap Heap Scan on public.wa
   Output: id, x, b, v, t
   Recheck Cond: ((wa.x = 3) OR (wa.x = 4))
   Filter: (wa.t ~~ 't1%'::text)
   ->  Bitmap Index Scan on wa_x
         Index Cond: (wa.x = ANY ('{3,4}'::integer[]))
(6 rows)

RESET enable_seqscan;
EXPLAIN (VERBOSE, COSTS OFF) SELECT * FROM wa WHERE x = 1;
           QUERY PLAN            
---------------------------------
 Bitmap Heap Scan on public.wa
   Output: id, x, b, v, t
   Recheck Cond: (wa.x = 1)
   ->  Bitmap Index Scan on wa_x
         Index Cond: (wa.x = 1)
(5 rows)

EXPLAIN (VERBOSE, COSTS OFF) SELECT * FROM (SELECT * FROM wa WHERE x = 1 OFFSET 0) s;
               QUERY PLAN                
-----------------------------------------
 Bitmap Heap Scan on public.wa
   Output: wa.id, wa.x, wa.b, wa.v, wa.t
   Recheck Cond: (wa.x = 1)
   ->  Bitmap Index Scan on wa_x
         Index Cond: (wa.x = 1)
(5 rows)

EXPLAIN (VERBOSE, COSTS OFF) SELECT * FROM (VALUES (1, 2), (3, 4)) v(a, b);
                    QUERY PLAN                    
--------------------------------------------------
 Values Scan on "*VALUES*"
   Output: "*VALUES*".column1, "*VALUES*".column2
(2 rows)

EXPLAIN (VERBOSE, COSTS OFF) SELECT 1;
 QUERY PLAN  
-------------
 Result
   Output: 1
(2 rows)

EXPLAIN (VERBOSE, COSTS OFF) SELECT * FROM generate_series(1, 2) g;
                  QUERY PLAN                   
-----------------------------------------------
 Function Scan on pg_catalog.generate_series g
   Output: g
   Function Call: generate_series(1, 2)
(3 rows)

EXPLAIN (VERBOSE, COSTS OFF) WITH c AS MATERIALIZED (SELECT * FROM wa WHERE id < 3) SELECT * FROM c;
                   QUERY PLAN                    
-------------------------------------------------
 CTE Scan on c
   Output: c.id, c.x, c.b, c.v, c.t
   CTE c
     ->  Index Scan using wa_pkey on public.wa
           Output: wa.id, wa.x, wa.b, wa.v, wa.t
           Index Cond: (wa.id < 3)
(6 rows)

EXPLAIN (VERBOSE, COSTS OFF) SELECT * FROM wa, wb WHERE wa.id = wb.id AND wa.id < 3;
                      QUERY PLAN                      
------------------------------------------------------
 Hash Join
   Output: wa.id, wa.x, wa.b, wa.v, wa.t, wb.id, wb.y
   Inner Unique: true
   Hash Cond: (wb.id = wa.id)
   ->  Seq Scan on public.wb
         Output: wb.id, wb.y
   ->  Hash
         Output: wa.id, wa.x, wa.b, wa.v, wa.t
         ->  Index Scan using wa_pkey on public.wa
               Output: wa.id, wa.x, wa.b, wa.v, wa.t
               Index Cond: (wa.id < 3)
(11 rows)

-- ===== src/backend/catalog/dependency.c:find_expr_references_walker|RTEKind (RTE_JOIN/RTE_NAMEDTUPLESTORE) =====
CREATE TABLE dep_i (k int, a int);
CREATE TABLE dep_n (k numeric, b int);
CREATE TABLE dep_b (k bigint, c int);
CREATE VIEW dep_v AS SELECT * FROM dep_i JOIN dep_n USING (k);
CREATE VIEW dep_v2 AS SELECT k, a, c FROM dep_i FULL JOIN dep_b USING (k);
CREATE VIEW dep_v3 AS SELECT j.* FROM (dep_i JOIN dep_n USING (k)) j WHERE j.k > 1;
SELECT c.relname, pg_describe_object(d.refclassid, d.refobjid, d.refobjsubid) AS ref, d.deptype
FROM pg_depend d JOIN pg_rewrite r ON d.classid = 'pg_rewrite'::regclass AND d.objid = r.oid
JOIN pg_class c ON c.oid = r.ev_class
WHERE c.relname IN ('dep_v', 'dep_v2', 'dep_v3')
ORDER BY 1, 2, 3;
 relname |           ref           | deptype 
---------+-------------------------+---------
 dep_v   | column a of table dep_i | n
 dep_v   | column b of table dep_n | n
 dep_v   | column k of table dep_i | n
 dep_v   | column k of table dep_n | n
 dep_v   | view dep_v              | i
 dep_v2  | column a of table dep_i | n
 dep_v2  | column c of table dep_b | n
 dep_v2  | column k of table dep_b | n
 dep_v2  | column k of table dep_i | n
 dep_v2  | view dep_v2             | i
 dep_v3  | column a of table dep_i | n
 dep_v3  | column b of table dep_n | n
 dep_v3  | column k of table dep_i | n
 dep_v3  | column k of table dep_n | n
 dep_v3  | view dep_v3             | i
(15 rows)

-- ===== src/backend/executor/execAmi.c:ExecReScan|NodeTag (HashState) =====
-- ===== src/backend/executor/execProcnode.c:ExecEndNode|NodeTag (HashState) =====
-- ===== src/backend/executor/execProcnode.c:ExecShutdownNode_walker|NodeTag (HashState) =====
SET enable_nestloop = off; SET enable_mergejoin = off;
EXPLAIN (COSTS OFF) SELECT o.y, (SELECT count(*) FROM wa JOIN wb ON wa.id = wb.id WHERE wb.y = o.y) FROM (VALUES (1), (2), (3)) o(y);
                          QUERY PLAN                          
--------------------------------------------------------------
 Values Scan on "*VALUES*"
   SubPlan 1
     ->  Aggregate
           ->  Hash Join
                 Hash Cond: (wa.id = wb.id)
                 ->  Seq Scan on wa
                 ->  Hash
                       ->  Seq Scan on wb
                             Filter: (y = "*VALUES*".column1)
(9 rows)

SELECT o.y, (SELECT count(*) FROM wa JOIN wb ON wa.id = wb.id WHERE wb.y = o.y) FROM (VALUES (1), (2), (3)) o(y) ORDER BY 1;
 y | count 
---+-------
 1 |    72
 2 |    72
 3 |    72
(3 rows)

SELECT * FROM (VALUES (1), (2)) o(y), LATERAL (SELECT count(*) AS c FROM wa JOIN wb ON wa.id = wb.id WHERE wb.y = o.y) t ORDER BY 1;
 y | c  
---+----
 1 | 72
 2 | 72
(2 rows)

EXPLAIN (COSTS OFF) SELECT * FROM (VALUES (1), (2)) o(y), LATERAL (SELECT count(*) AS c FROM wa JOIN wb ON wa.id = wb.id WHERE wb.y = o.y) t;
                         QUERY PLAN                         
------------------------------------------------------------
 Nested Loop
   Disabled: true
   ->  Values Scan on "*VALUES*"
   ->  Aggregate
         ->  Hash Join
               Hash Cond: (wa.id = wb.id)
               ->  Seq Scan on wa
               ->  Hash
                     ->  Seq Scan on wb
                           Filter: (y = "*VALUES*".column1)
(10 rows)

SELECT count(*) FROM (SELECT * FROM wa JOIN wb ON wa.id = wb.id LIMIT 5) s;
 count 
-------
     5
(1 row)

SET max_parallel_workers_per_gather = 2; SET enable_parallel_hash = on;
EXPLAIN (COSTS OFF) SELECT count(*) FROM wa JOIN wb ON wa.id = wb.id;
                      QUERY PLAN                       
-------------------------------------------------------
 Finalize Aggregate
   ->  Gather
         Workers Planned: 2
         ->  Partial Aggregate
               ->  Parallel Hash Join
                     Hash Cond: (wa.id = wb.id)
                     ->  Parallel Seq Scan on wa
                     ->  Parallel Hash
                           ->  Parallel Seq Scan on wb
(9 rows)

SELECT count(*) FROM wa JOIN wb ON wa.id = wb.id;
 count 
-------
   500
(1 row)

SELECT count(*) FROM (SELECT * FROM wa JOIN wb ON wa.id = wb.id LIMIT 5) s;
 count 
-------
     5
(1 row)

SET max_parallel_workers_per_gather = 0;
RESET enable_nestloop; RESET enable_mergejoin;
-- ===== src/backend/commands/explain.c:ExplainNode|CmdType (CMD_SELECT) =====
EXPLAIN (COSTS OFF) INSERT INTO wb SELECT 1000, 1;
  QUERY PLAN  
--------------
 Insert on wb
   ->  Result
(2 rows)

EXPLAIN (COSTS OFF) UPDATE wb SET y = 1 WHERE id = 1;
              QUERY PLAN              
--------------------------------------
 Update on wb
   ->  Index Scan using wb_pkey on wb
         Index Cond: (id = 1)
(3 rows)

EXPLAIN (COSTS OFF) DELETE FROM wb WHERE id = 1;
              QUERY PLAN              
--------------------------------------
 Delete on wb
   ->  Index Scan using wb_pkey on wb
         Index Cond: (id = 1)
(3 rows)

EXPLAIN (COSTS OFF) MERGE INTO wb USING wa ON wa.id = wb.id WHEN MATCHED THEN DELETE;
             QUERY PLAN             
------------------------------------
 Merge on wb
   ->  Hash Join
         Hash Cond: (wa.id = wb.id)
         ->  Seq Scan on wa
         ->  Hash
               ->  Seq Scan on wb
(6 rows)

EXPLAIN (COSTS OFF) INSERT INTO wb VALUES (1000, 1) ON CONFLICT (id) DO UPDATE SET y = EXCLUDED.y;
             QUERY PLAN              
-------------------------------------
 Insert on wb
   Conflict Resolution: UPDATE
   Conflict Arbiter Indexes: wb_pkey
   ->  Result
(4 rows)

-- ===== src/backend/parser/parse_clause.c:flatten_grouping_sets|NodeTag (List) =====
SELECT x, b, count(*) FROM wa WHERE id < 20 GROUP BY GROUPING SETS ((x, b), ROLLUP (x), CUBE (b), ()) ORDER BY 1, 2, 3;
 x | b | count 
---+---+-------
 0 | t |     1
 0 |   |     1
 1 | f |     2
 1 |   |     2
 2 | t |     2
 2 |   |     2
 3 | f |     2
 3 |   |     2
 4 | t |     2
 4 |   |     2
 5 | f |     2
 5 |   |     2
 6 | t |     2
 6 |   |     2
 7 | f |     2
 7 |   |     2
 8 | t |     2
 8 |   |     2
 9 | f |     2
 9 |   |     2
   | f |    10
   | t |     9
   |   |    19
   |   |    19
   |   |    19
(25 rows)

SELECT x, b, count(*) FROM wa WHERE id < 20 GROUP BY (x, b) ORDER BY 1, 2;
 x | b | count 
---+---+-------
 0 | t |     1
 1 | f |     2
 2 | t |     2
 3 | f |     2
 4 | t |     2
 5 | f |     2
 6 | t |     2
 7 | f |     2
 8 | t |     2
 9 | f |     2
(10 rows)

SELECT x, b, count(*) FROM wa WHERE id < 20 GROUP BY GROUPING SETS ((x, (b)), ((x), b)) ORDER BY 1, 2, 3;
 x | b | count 
---+---+-------
 0 | t |     1
 0 | t |     1
 1 | f |     2
 1 | f |     2
 2 | t |     2
 2 | t |     2
 3 | f |     2
 3 | f |     2
 4 | t |     2
 4 | t |     2
 5 | f |     2
 5 | f |     2
 6 | t |     2
 6 | t |     2
 7 | f |     2
 7 | f |     2
 8 | t |     2
 8 | t |     2
 9 | f |     2
 9 | f |     2
(20 rows)

SELECT x, count(*) FROM wa WHERE id < 20 GROUP BY GROUPING SETS (GROUPING SETS (x, ()), x) ORDER BY 1, 2;
 x | count 
---+-------
 0 |     1
 0 |     1
 1 |     2
 1 |     2
 2 |     2
 2 |     2
 3 |     2
 3 |     2
 4 |     2
 4 |     2
 5 |     2
 5 |     2
 6 |     2
 6 |     2
 7 |     2
 7 |     2
 8 |     2
 8 |     2
 9 |     2
 9 |     2
   |    19
(21 rows)

SELECT x, b, v, count(*) FROM wa WHERE id < 20 GROUP BY x, (b, v) ORDER BY 1, 2, 3;
 x | b | v  | count 
---+---+----+-------
 0 | t | v0 |     1
 1 | f | v1 |     2
 2 | t | v2 |     2
 3 | f | v3 |     2
 4 | t | v4 |     2
 5 | f | v0 |     2
 6 | t | v1 |     2
 7 | f | v2 |     2
 8 | t | v3 |     2
 9 | f | v4 |     2
(10 rows)

SELECT x, b, count(*) FROM wa WHERE id < 20 GROUP BY ROLLUP ((x, b)) ORDER BY 1, 2, 3;
 x | b | count 
---+---+-------
 0 | t |     1
 1 | f |     2
 2 | t |     2
 3 | f |     2
 4 | t |     2
 5 | f |     2
 6 | t |     2
 7 | f |     2
 8 | t |     2
 9 | f |     2
   |   |    19
(11 rows)

EXPLAIN (COSTS OFF) SELECT x, b, count(*) FROM wa GROUP BY GROUPING SETS ((x, (b)), ((x), b));
      QUERY PLAN      
----------------------
 HashAggregate
   Hash Key: x, b
   Hash Key: x, b
   ->  Seq Scan on wa
(4 rows)

-- ===== src/backend/utils/adt/ruleutils.c:get_sublink_expr|SubLinkType (CTE_SUBLINK) =====
CREATE VIEW wv_sublinks AS SELECT (SELECT 1) AS a, EXISTS(SELECT 1) AS e, 1 = ANY(SELECT id FROM wb) AS an,
  1 < ALL(SELECT id FROM wb) AS al, ARRAY(SELECT id FROM wb WHERE id < 3) AS ar, (1, 2) < (SELECT 1, 2) AS rc,
  1 IN (SELECT 1) AS i, 1 NOT IN (SELECT 2) AS ni, 5 > SOME(SELECT id FROM wb) AS so;
SELECT pg_get_viewdef('wv_sublinks'::regclass);
           pg_get_viewdef            
-------------------------------------
  SELECT ( SELECT 1) AS a,          +
     (EXISTS ( SELECT 1)) AS e,     +
     (1 IN ( SELECT wb.id           +
            FROM wb)) AS an,        +
     (1 < ALL ( SELECT wb.id        +
            FROM wb)) AS al,        +
     ARRAY( SELECT wb.id            +
            FROM wb                 +
           WHERE (wb.id < 3)) AS ar,+
     ((1, 2) < ( SELECT 1,          +
             2)) AS rc,             +
     (1 IN ( SELECT 1)) AS i,       +
     (NOT (1 IN ( SELECT 2))) AS ni,+
     (5 > ANY ( SELECT wb.id        +
            FROM wb)) AS so;
(1 row)

SELECT * FROM wv_sublinks;
 a | e | an | al |  ar   | rc | i | ni | so 
---+---+----+----+-------+----+---+----+----
 1 | t | t  | f  | {1,2} | f  | t | t  | t
(1 row)

CREATE VIEW wv_cte AS WITH RECURSIVE r(n) AS (SELECT 1 UNION ALL SELECT n + 1 FROM r WHERE n < 3) SELECT n FROM r WHERE EXISTS (SELECT 1 FROM r r2 WHERE r2.n > r.n);
SELECT pg_get_viewdef('wv_cte'::regclass);
         pg_get_viewdef          
---------------------------------
  WITH RECURSIVE r(n) AS (      +
          SELECT 1 AS "?column?"+
         UNION ALL              +
          SELECT (r_1.n + 1)    +
            FROM r r_1          +
           WHERE (r_1.n < 3)    +
         )                      +
  SELECT n                      +
    FROM r                      +
   WHERE (EXISTS ( SELECT 1     +
            FROM r r2           +
           WHERE (r2.n > r.n)));
(1 row)

SELECT * FROM wv_cte;
 n 
---
 1
 2
(2 rows)

-- ===== src/backend/parser/analyze.c:transformInsertRow|NodeTag (CoerceToDomain/FieldStore/SubscriptingRef) =====
CREATE TYPE cpx AS (a int, b int);
CREATE DOMAIN dpos AS int CHECK (VALUE > 0);
CREATE DOMAIN dcpx AS cpx CHECK ((VALUE).a IS NOT NULL);
CREATE TABLE wi (id int, c cpx, arr int[], d dpos, dc dcpx, arr2 int[][], darr dpos[]);
INSERT INTO wi (id, c.a, c.b) VALUES (1, 10, 20), (2, 30, 40);
ERROR:  23514: value for domain dcpx violates check constraint "dcpx_check"
SCHEMA NAME:  public
DATATYPE NAME:  dcpx
CONSTRAINT NAME:  dcpx_check
INSERT INTO wi (id, arr[1], arr[2]) VALUES (3, 1, 2), (4, 3, 4);
ERROR:  23514: value for domain dcpx violates check constraint "dcpx_check"
SCHEMA NAME:  public
DATATYPE NAME:  dcpx
CONSTRAINT NAME:  dcpx_check
INSERT INTO wi (id, d) VALUES (5, 7), (6, 8);
ERROR:  23514: value for domain dcpx violates check constraint "dcpx_check"
SCHEMA NAME:  public
DATATYPE NAME:  dcpx
CONSTRAINT NAME:  dcpx_check
INSERT INTO wi (id, d) VALUES (7, -1);
ERROR:  23514: value for domain dpos violates check constraint "dpos_check"
SCHEMA NAME:  public
DATATYPE NAME:  dpos
CONSTRAINT NAME:  dpos_check
INSERT INTO wi (id, d) VALUES (7, 1), (8, -1);
ERROR:  23514: value for domain dcpx violates check constraint "dcpx_check"
SCHEMA NAME:  public
DATATYPE NAME:  dcpx
CONSTRAINT NAME:  dcpx_check
INSERT INTO wi (id, dc.a) VALUES (8, 1), (9, 2);
INSERT INTO wi (id, dc.a, dc.b) VALUES (10, 1, 2), (11, 3, 4);
INSERT INTO wi (id, dc.b) VALUES (12, 5);
ERROR:  23514: value for domain dcpx violates check constraint "dcpx_check"
SCHEMA NAME:  public
DATATYPE NAME:  dcpx
CONSTRAINT NAME:  dcpx_check
INSERT INTO wi (id, arr2[1][1], arr2[1][2]) VALUES (13, 1, 2), (14, 3, 4);
ERROR:  23514: value for domain dcpx violates check constraint "dcpx_check"
SCHEMA NAME:  public
DATATYPE NAME:  dcpx
CONSTRAINT NAME:  dcpx_check
INSERT INTO wi (id, c.a, arr[1]) SELECT 15, 5, 6;
ERROR:  23514: value for domain dcpx violates check constraint "dcpx_check"
SCHEMA NAME:  public
DATATYPE NAME:  dcpx
CONSTRAINT NAME:  dcpx_check
INSERT INTO wi (id, c.a, c.b) VALUES (16, 1, 2) ON CONFLICT DO NOTHING;
ERROR:  23514: value for domain dcpx violates check constraint "dcpx_check"
SCHEMA NAME:  public
DATATYPE NAME:  dcpx
CONSTRAINT NAME:  dcpx_check
INSERT INTO wi (id, darr[1], darr[2]) VALUES (17, 1, 2), (18, 3, 4);
ERROR:  23514: value for domain dcpx violates check constraint "dcpx_check"
SCHEMA NAME:  public
DATATYPE NAME:  dcpx
CONSTRAINT NAME:  dcpx_check
INSERT INTO wi (id, darr[1]) VALUES (19, -5);
ERROR:  23514: value for domain dcpx violates check constraint "dcpx_check"
SCHEMA NAME:  public
DATATYPE NAME:  dcpx
CONSTRAINT NAME:  dcpx_check
INSERT INTO wi (id, c.a) VALUES (20, DEFAULT), (21, 1);
ERROR:  0A000: cannot set a subfield to DEFAULT
LINE 1: INSERT INTO wi (id, c.a) VALUES (20, DEFAULT), (21, 1);
                            ^
INSERT INTO wi (id, arr[1:2]) VALUES (22, '{7,8}'), (23, '{9,10}');
ERROR:  23514: value for domain dcpx violates check constraint "dcpx_check"
SCHEMA NAME:  public
DATATYPE NAME:  dcpx
CONSTRAINT NAME:  dcpx_check
INSERT INTO wi (id, c) VALUES (24, ROW(1, 2)), (25, DEFAULT);
ERROR:  23514: value for domain dcpx violates check constraint "dcpx_check"
SCHEMA NAME:  public
DATATYPE NAME:  dcpx
CONSTRAINT NAME:  dcpx_check
INSERT INTO wi (id, c.a, c) VALUES (26, 1, ROW(3, 4));
ERROR:  42701: column "c" specified more than once
LINE 1: INSERT INTO wi (id, c.a, c) VALUES (26, 1, ROW(3, 4));
                                 ^
INSERT INTO wi (id, c, c.a) VALUES (27, ROW(3, 4), 1);
ERROR:  42701: column "c" specified more than once
LINE 1: INSERT INTO wi (id, c, c.a) VALUES (27, ROW(3, 4), 1);
                               ^
INSERT INTO wi (id, c.a, c.a) VALUES (28, 1, 2);
ERROR:  23514: value for domain dcpx violates check constraint "dcpx_check"
SCHEMA NAME:  public
DATATYPE NAME:  dcpx
CONSTRAINT NAME:  dcpx_check
SELECT * FROM wi ORDER BY id;
 id | c | arr | d |  dc   | arr2 | darr 
----+---+-----+---+-------+------+------
  8 |   |     |   | (1,)  |      | 
  9 |   |     |   | (2,)  |      | 
 10 |   |     |   | (1,2) |      | 
 11 |   |     |   | (3,4) |      | 
(4 rows)

-- ===== src/backend/rewrite/rewriteManip.c:ChangeVarNodes_walker|NodeTag (AppendRelInfo/PlanRowMark) =====
-- self-join elimination with row marks and append-rel entries in the query.
CREATE TABLE sje (id int PRIMARY KEY, v int);
INSERT INTO sje SELECT i, i * 2 FROM generate_series(1, 10) i;
VACUUM ANALYZE sje;
EXPLAIN (COSTS OFF) SELECT a.id, b.v FROM sje a JOIN sje b ON a.id = b.id WHERE a.v > 4;
    QUERY PLAN     
-------------------
 Seq Scan on sje b
   Filter: (v > 4)
(2 rows)

EXPLAIN (COSTS OFF) SELECT a.id, b.v FROM sje a JOIN sje b ON a.id = b.id WHERE a.v > 4 FOR UPDATE;
       QUERY PLAN        
-------------------------
 LockRows
   ->  Seq Scan on sje b
         Filter: (v > 4)
(3 rows)

SELECT a.id, b.v FROM sje a JOIN sje b ON a.id = b.id WHERE a.v > 4 ORDER BY 1 LIMIT 3;
 id | v  
----+----
  3 |  6
  4 |  8
  5 | 10
(3 rows)

SELECT a.id, b.v FROM sje a JOIN sje b ON a.id = b.id WHERE a.v > 4 ORDER BY 1 LIMIT 3 FOR UPDATE OF b;
 id | v  
----+----
  3 |  6
  4 |  8
  5 | 10
(3 rows)

EXPLAIN (COSTS OFF) SELECT a.id, b.v, u.id FROM sje a JOIN sje b ON a.id = b.id JOIN (SELECT id FROM wa UNION ALL SELECT id FROM wb) u ON u.id = a.id WHERE b.v = 4;
                   QUERY PLAN                    
-------------------------------------------------
 Nested Loop
   ->  Seq Scan on sje b
         Filter: (v = 4)
   ->  Append
         ->  Index Only Scan using wa_pkey on wa
               Index Cond: (id = b.id)
         ->  Index Only Scan using wb_pkey on wb
               Index Cond: (id = b.id)
(8 rows)

SELECT a.id, b.v, u.id FROM sje a JOIN sje b ON a.id = b.id JOIN (SELECT id FROM wa UNION ALL SELECT id FROM wb) u ON u.id = a.id WHERE b.v = 4 ORDER BY 1;
 id | v | id 
----+---+----
  2 | 4 |  2
  2 | 4 |  2
(2 rows)

EXPLAIN (COSTS OFF) SELECT a.id, b.v FROM sje a JOIN sje b ON a.id = b.id JOIN (SELECT id FROM wa UNION ALL SELECT id FROM wb) u ON u.id = b.id WHERE b.v = 4 FOR SHARE OF a;
                      QUERY PLAN                       
-------------------------------------------------------
 LockRows
   ->  Nested Loop
         ->  Hash Join
               Hash Cond: (a.id = b.id)
               ->  Seq Scan on sje a
               ->  Hash
                     ->  Seq Scan on sje b
                           Filter: (v = 4)
         ->  Append
               ->  Index Only Scan using wa_pkey on wa
                     Index Cond: (id = a.id)
               ->  Index Only Scan using wb_pkey on wb
                     Index Cond: (id = a.id)
(13 rows)

SELECT a.id, b.v FROM sje a JOIN sje b ON a.id = b.id JOIN (SELECT id FROM wa UNION ALL SELECT id FROM wb) u ON u.id = b.id WHERE b.v = 4 ORDER BY 1 FOR SHARE OF a;
 id | v 
----+---
  2 | 4
  2 | 4
(2 rows)

-- ===== src/backend/statistics/mcv.c:mcv_get_match_bitmap|NodeTag (RestrictInfo/Var) =====
CREATE STATISTICS wa_mcv (mcv) ON x, b FROM wa;
ANALYZE wa;
EXPLAIN SELECT * FROM wa WHERE x = 1 AND b;
                             QUERY PLAN                              
---------------------------------------------------------------------
 Bitmap Heap Scan on wa  (cost=4.90..13.15 rows=1 width=16)
   Recheck Cond: (x = 1)
   Filter: b
   ->  Bitmap Index Scan on wa_x  (cost=0.00..4.90 rows=100 width=0)
         Index Cond: (x = 1)
(5 rows)

EXPLAIN SELECT * FROM wa WHERE x = 2 AND NOT b;
                             QUERY PLAN                              
---------------------------------------------------------------------
 Bitmap Heap Scan on wa  (cost=4.90..13.15 rows=1 width=16)
   Recheck Cond: (x = 2)
   Filter: (NOT b)
   ->  Bitmap Index Scan on wa_x  (cost=0.00..4.90 rows=100 width=0)
         Index Cond: (x = 2)
(5 rows)

EXPLAIN SELECT * FROM wa WHERE x = 1 AND b IS TRUE;
                             QUERY PLAN                              
---------------------------------------------------------------------
 Bitmap Heap Scan on wa  (cost=4.91..13.16 rows=50 width=16)
   Recheck Cond: (x = 1)
   Filter: (b IS TRUE)
   ->  Bitmap Index Scan on wa_x  (cost=0.00..4.90 rows=100 width=0)
         Index Cond: (x = 1)
(5 rows)

EXPLAIN SELECT * FROM wa WHERE (x = 1 OR x = 2) AND b;
                             QUERY PLAN                              
---------------------------------------------------------------------
 Bitmap Heap Scan on wa  (cost=5.68..15.68 rows=100 width=16)
   Recheck Cond: ((x = 1) OR (x = 2))
   Filter: b
   ->  Bitmap Index Scan on wa_x  (cost=0.00..5.65 rows=200 width=0)
         Index Cond: (x = ANY ('{1,2}'::integer[]))
(5 rows)

EXPLAIN SELECT * FROM wa WHERE x IN (1, 3) AND b = false;
                             QUERY PLAN                              
---------------------------------------------------------------------
 Bitmap Heap Scan on wa  (cost=5.70..15.20 rows=200 width=16)
   Recheck Cond: (x = ANY ('{1,3}'::integer[]))
   Filter: (NOT b)
   ->  Bitmap Index Scan on wa_x  (cost=0.00..5.65 rows=200 width=0)
         Index Cond: (x = ANY ('{1,3}'::integer[]))
(5 rows)

SELECT count(*) FROM wa WHERE x = 1 AND b;
 count 
-------
     0
(1 row)

SELECT count(*) FROM wa WHERE x = 2 AND NOT b;
 count 
-------
     0
(1 row)

-- ===== src/backend/optimizer/plan/setrefs.c:set_join_references|NodeTag (Var) =====
SET enable_hashjoin = off; SET enable_mergejoin = off;
EXPLAIN (VERBOSE, COSTS OFF) SELECT wa.t FROM wb, wa WHERE wa.id = wb.id AND wb.id < 3;
                    QUERY PLAN                    
--------------------------------------------------
 Nested Loop
   Output: wa.t
   Inner Unique: true
   ->  Index Only Scan using wb_pkey on public.wb
         Output: wb.id
         Index Cond: (wb.id < 3)
   ->  Index Scan using wa_pkey on public.wa
         Output: wa.id, wa.x, wa.b, wa.v, wa.t
         Index Cond: (wa.id = wb.id)
(9 rows)

SELECT wa.t FROM wb, wa WHERE wa.id = wb.id AND wb.id < 3 ORDER BY 1;
 t  
----
 t1
 t2
(2 rows)

EXPLAIN (VERBOSE, COSTS OFF) SELECT wa.t, wb.y FROM wb JOIN wa ON wa.x = wb.y + 1 WHERE wb.id = 3;
                  QUERY PLAN                   
-----------------------------------------------
 Nested Loop
   Output: wa.t, wb.y
   ->  Index Scan using wb_pkey on public.wb
         Output: wb.id, wb.y
         Index Cond: (wb.id = 3)
   ->  Bitmap Heap Scan on public.wa
         Output: wa.id, wa.x, wa.b, wa.v, wa.t
         Recheck Cond: (wa.x = (wb.y + 1))
         ->  Bitmap Index Scan on wa_x
               Index Cond: (wa.x = (wb.y + 1))
(10 rows)

SELECT wa.t, wb.y FROM wb JOIN wa ON wa.x = wb.y + 1 WHERE wb.id = 3 ORDER BY 1 LIMIT 2;
  t   | y 
------+---
 t104 | 3
 t114 | 3
(2 rows)

RESET enable_hashjoin; RESET enable_mergejoin;
-- ===== src/backend/optimizer/prep/prepjointree.c:reduce_outer_joins_pass2|NodeTag (RangeTblRef) =====
EXPLAIN (COSTS OFF) SELECT * FROM wa LEFT JOIN wb ON wa.id = wb.id WHERE wb.y = 1;
          QUERY PLAN           
-------------------------------
 Hash Join
   Hash Cond: (wa.id = wb.id)
   ->  Seq Scan on wa
   ->  Hash
         ->  Seq Scan on wb
               Filter: (y = 1)
(6 rows)

EXPLAIN (COSTS OFF) SELECT * FROM wa LEFT JOIN (wb LEFT JOIN sje ON wb.id = sje.id) ON wa.id = wb.id WHERE sje.v = 4;
                 QUERY PLAN                 
--------------------------------------------
 Nested Loop
   Join Filter: (wb.id = sje.id)
   ->  Merge Join
         Merge Cond: (wa.id = sje.id)
         ->  Index Scan using wa_pkey on wa
         ->  Sort
               Sort Key: sje.id
               ->  Seq Scan on sje
                     Filter: (v = 4)
   ->  Index Scan using wb_pkey on wb
         Index Cond: (id = wa.id)
(11 rows)

EXPLAIN (COSTS OFF) SELECT * FROM wa FULL JOIN wb ON wa.id = wb.id WHERE wa.x = 1;
                 QUERY PLAN                  
---------------------------------------------
 Hash Right Join
   Hash Cond: (wb.id = wa.id)
   ->  Seq Scan on wb
   ->  Hash
         ->  Bitmap Heap Scan on wa
               Recheck Cond: (x = 1)
               ->  Bitmap Index Scan on wa_x
                     Index Cond: (x = 1)
(8 rows)

EXPLAIN (COSTS OFF) SELECT * FROM wa RIGHT JOIN wb ON wa.id = wb.id WHERE wa.x = 1;
                 QUERY PLAN                  
---------------------------------------------
 Hash Join
   Hash Cond: (wb.id = wa.id)
   ->  Seq Scan on wb
   ->  Hash
         ->  Bitmap Heap Scan on wa
               Recheck Cond: (x = 1)
               ->  Bitmap Index Scan on wa_x
                     Index Cond: (x = 1)
(8 rows)

EXPLAIN (COSTS OFF) SELECT * FROM wa LEFT JOIN wb ON wa.id = wb.id LEFT JOIN sje ON sje.id = wb.id WHERE wb.y IS NOT NULL;
                 QUERY PLAN                  
---------------------------------------------
 Hash Left Join
   Hash Cond: (wb.id = sje.id)
   ->  Hash Join
         Hash Cond: (wa.id = wb.id)
         ->  Seq Scan on wa
         ->  Hash
               ->  Seq Scan on wb
                     Filter: (y IS NOT NULL)
   ->  Hash
         ->  Seq Scan on sje
(10 rows)

SELECT count(*) FROM wa LEFT JOIN (wb LEFT JOIN sje ON wb.id = sje.id) ON wa.id = wb.id WHERE sje.v = 4;
 count 
-------
     1
(1 row)

-- ===== src/backend/parser/parse_relation.c:expandRTE|NodeTag (Var) =====
SELECT * FROM wa JOIN wb USING (id) ORDER BY id LIMIT 2;
 id | x | b | v  | t  | y 
----+---+---+----+----+---
  1 | 1 | f | v1 | t1 | 1
  2 | 2 | t | v2 | t2 | 2
(2 rows)

SELECT j FROM (wa JOIN wb USING (id)) j ORDER BY 1 LIMIT 2;
        j        
-----------------
 (1,1,f,v1,t1,1)
 (2,2,t,v2,t2,2)
(2 rows)

SELECT j.* FROM (wa JOIN wb USING (id)) j ORDER BY 1 LIMIT 2;
 id | x | b | v  | t  | y 
----+---+---+----+----+---
  1 | 1 | f | v1 | t1 | 1
  2 | 2 | t | v2 | t2 | 2
(2 rows)

SELECT * FROM (wa FULL JOIN wb USING (id)) j WHERE id > 998 ORDER BY 1;
  id  | x | b | v  |   t   | y 
------+---+---+----+-------+---
  999 | 9 | f | v4 | t999  |  
 1000 | 0 | t | v0 | t1000 |  
(2 rows)

SELECT row_to_json(j) FROM (wa FULL JOIN wb USING (id)) j WHERE id > 998 ORDER BY id;
                       row_to_json                        
----------------------------------------------------------
 {"id":999,"x":9,"b":false,"v":"v4","t":"t999","y":null}
 {"id":1000,"x":0,"b":true,"v":"v0","t":"t1000","y":null}
(2 rows)

SELECT * FROM (SELECT 1 AS a) s NATURAL JOIN (SELECT 1::bigint AS a) t;
 a 
---
 1
(1 row)

SELECT j FROM ((SELECT 1 AS a) s NATURAL JOIN (SELECT 1::bigint AS a) t) j;
  j  
-----
 (1)
(1 row)

SELECT * FROM ((SELECT 1 AS a, 'x' AS s) s NATURAL FULL JOIN (SELECT 2::numeric AS a, 'y' AS u) t) j ORDER BY 1;
 a | s | u 
---+---+---
 1 | x | 
 2 |   | y
(2 rows)

SELECT pg_typeof(j.a) FROM ((SELECT 1 AS a) s NATURAL FULL JOIN (SELECT 2::numeric AS a) t) j LIMIT 1;
 pg_typeof 
-----------
 numeric
(1 row)

-- ===== src/backend/partitioning/partprune.c:gen_partprune_steps_internal|NodeTag (RestrictInfo) =====
-- ===== src/backend/partitioning/partprune.c:match_clause_to_partition_key|NodeTag (RelabelType) =====
-- ===== src/backend/optimizer/util/pathnode.c:path_is_reparameterizable_by_child|NodeTag (ForeignPath/GatherPath) =====
-- ===== src/backend/optimizer/util/pathnode.c:reparameterize_path_by_child|NodeTag (ForeignPath/GatherPath) =====
CREATE TABLE pa (id int, v text) PARTITION BY RANGE (id);
CREATE TABLE pa1 PARTITION OF pa FOR VALUES FROM (0) TO (100);
CREATE TABLE pa2 PARTITION OF pa FOR VALUES FROM (100) TO (200);
CREATE TABLE pb (id int, w text) PARTITION BY RANGE (id);
CREATE TABLE pb1 PARTITION OF pb FOR VALUES FROM (0) TO (100);
CREATE TABLE pb2 PARTITION OF pb FOR VALUES FROM (100) TO (200);
CREATE INDEX ON pb1 (id);
CREATE INDEX ON pb2 (id);
INSERT INTO pa SELECT i, 'a' || i FROM generate_series(0, 199) i;
INSERT INTO pb SELECT i, 'b' || i FROM generate_series(0, 199, 2) i;
VACUUM ANALYZE pa;
VACUUM ANALYZE pb;
EXPLAIN (COSTS OFF) SELECT * FROM pa WHERE id = 5;
     QUERY PLAN     
--------------------
 Seq Scan on pa1 pa
   Filter: (id = 5)
(2 rows)

EXPLAIN (COSTS OFF) SELECT * FROM pa WHERE id IN (5, 150);
                    QUERY PLAN                     
---------------------------------------------------
 Append
   ->  Seq Scan on pa1 pa_1
         Filter: (id = ANY ('{5,150}'::integer[]))
   ->  Seq Scan on pa2 pa_2
         Filter: (id = ANY ('{5,150}'::integer[]))
(5 rows)

EXPLAIN (COSTS OFF) SELECT * FROM pa WHERE id = ANY (ARRAY[5, 7]);
                QUERY PLAN                 
-------------------------------------------
 Seq Scan on pa1 pa
   Filter: (id = ANY ('{5,7}'::integer[]))
(2 rows)

EXPLAIN (COSTS OFF) SELECT * FROM pa WHERE id IS NULL;
        QUERY PLAN        
--------------------------
 Result
   One-Time Filter: false
(2 rows)

EXPLAIN (COSTS OFF) SELECT * FROM pa WHERE (id > 150 AND id < 160) OR id = 3;
                        QUERY PLAN                         
-----------------------------------------------------------
 Append
   ->  Seq Scan on pa1 pa_1
         Filter: (((id > 150) AND (id < 160)) OR (id = 3))
   ->  Seq Scan on pa2 pa_2
         Filter: (((id > 150) AND (id < 160)) OR (id = 3))
(5 rows)

EXPLAIN (COSTS OFF) SELECT * FROM pa WHERE id = 5 AND v = 'a5';
                QUERY PLAN                 
-------------------------------------------
 Seq Scan on pa1 pa
   Filter: ((id = 5) AND (v = 'a5'::text))
(2 rows)

EXPLAIN (ANALYZE, COSTS OFF, TIMING OFF, SUMMARY OFF, BUFFERS OFF) SELECT * FROM pa WHERE id = (SELECT 150);
                      QUERY PLAN                       
-------------------------------------------------------
 Append (actual rows=1.00 loops=1)
   InitPlan 1
     ->  Result (actual rows=1.00 loops=1)
   ->  Seq Scan on pa1 pa_1 (never executed)
         Filter: (id = (InitPlan 1).col1)
   ->  Seq Scan on pa2 pa_2 (actual rows=1.00 loops=1)
         Filter: (id = (InitPlan 1).col1)
         Rows Removed by Filter: 99
(8 rows)

EXPLAIN (ANALYZE, COSTS OFF, TIMING OFF, SUMMARY OFF, BUFFERS OFF) SELECT * FROM pa WHERE id = (SELECT 150) OR id = (SELECT 250);
                               QUERY PLAN                               
------------------------------------------------------------------------
 Append (actual rows=1.00 loops=1)
   InitPlan 1
     ->  Result (actual rows=1.00 loops=1)
   InitPlan 2
     ->  Result (actual rows=1.00 loops=1)
   ->  Seq Scan on pa1 pa_1 (never executed)
         Filter: ((id = (InitPlan 1).col1) OR (id = (InitPlan 2).col1))
   ->  Seq Scan on pa2 pa_2 (actual rows=1.00 loops=1)
         Filter: ((id = (InitPlan 1).col1) OR (id = (InitPlan 2).col1))
         Rows Removed by Filter: 99
(10 rows)

SELECT * FROM pa WHERE id = (SELECT 150);
 id  |  v   
-----+------
 150 | a150
(1 row)

SET enable_partitionwise_join = on;
SET enable_hashjoin = off; SET enable_mergejoin = off;
EXPLAIN (COSTS OFF) SELECT * FROM pa JOIN pb ON pa.id = pb.id WHERE pa.v = 'a4';
                QUERY PLAN                
------------------------------------------
 Append
   ->  Nested Loop
         Join Filter: (pb_1.id = pa_1.id)
         ->  Seq Scan on pa1 pa_1
               Filter: (v = 'a4'::text)
         ->  Seq Scan on pb1 pb_1
   ->  Nested Loop
         Join Filter: (pb_2.id = pa_2.id)
         ->  Seq Scan on pa2 pa_2
               Filter: (v = 'a4'::text)
         ->  Seq Scan on pb2 pb_2
(11 rows)

SELECT * FROM pa JOIN pb ON pa.id = pb.id WHERE pa.v = 'a4';
 id | v  | id | w  
----+----+----+----
  4 | a4 |  4 | b4
(1 row)

EXPLAIN (COSTS OFF) SELECT * FROM pa JOIN pb ON pa.id = pb.id WHERE pa.v IN ('a4', 'a150');
                         QUERY PLAN                          
-------------------------------------------------------------
 Append
   ->  Nested Loop
         Join Filter: (pb_1.id = pa_1.id)
         ->  Seq Scan on pb1 pb_1
         ->  Materialize
               ->  Seq Scan on pa1 pa_1
                     Filter: (v = ANY ('{a4,a150}'::text[]))
   ->  Nested Loop
         Join Filter: (pb_2.id = pa_2.id)
         ->  Seq Scan on pb2 pb_2
         ->  Materialize
               ->  Seq Scan on pa2 pa_2
                     Filter: (v = ANY ('{a4,a150}'::text[]))
(13 rows)

SET enable_seqscan = off;
EXPLAIN (COSTS OFF) SELECT * FROM pa JOIN pb ON pa.id = pb.id WHERE pa.v IN ('a4', 'a150');
                      QUERY PLAN                       
-------------------------------------------------------
 Append
   ->  Nested Loop
         ->  Seq Scan on pa1 pa_1
               Disabled: true
               Filter: (v = ANY ('{a4,a150}'::text[]))
         ->  Index Scan using pb1_id_idx on pb1 pb_1
               Index Cond: (id = pa_1.id)
   ->  Nested Loop
         ->  Seq Scan on pa2 pa_2
               Disabled: true
               Filter: (v = ANY ('{a4,a150}'::text[]))
         ->  Index Scan using pb2_id_idx on pb2 pb_2
               Index Cond: (id = pa_2.id)
(13 rows)

SET max_parallel_workers_per_gather = 2;
EXPLAIN (COSTS OFF) SELECT * FROM pa JOIN pb ON pa.id = pb.id WHERE pa.v IN ('a4', 'a150');
                         QUERY PLAN                          
-------------------------------------------------------------
 Gather
   Workers Planned: 2
   ->  Parallel Append
         ->  Nested Loop
               ->  Parallel Seq Scan on pa1 pa_1
                     Disabled: true
                     Filter: (v = ANY ('{a4,a150}'::text[]))
               ->  Index Scan using pb1_id_idx on pb1 pb_1
                     Index Cond: (id = pa_1.id)
         ->  Nested Loop
               ->  Parallel Seq Scan on pa2 pa_2
                     Disabled: true
                     Filter: (v = ANY ('{a4,a150}'::text[]))
               ->  Index Scan using pb2_id_idx on pb2 pb_2
                     Index Cond: (id = pa_2.id)
(15 rows)

SET max_parallel_workers_per_gather = 0;
RESET enable_seqscan;
RESET enable_hashjoin; RESET enable_mergejoin;
RESET enable_partitionwise_join;
CREATE TABLE pl (k varchar(10), n int) PARTITION BY LIST (k);
CREATE TABLE pl_a PARTITION OF pl FOR VALUES IN ('a');
CREATE TABLE pl_b PARTITION OF pl FOR VALUES IN ('b', 'c');
CREATE TABLE pl_d PARTITION OF pl DEFAULT;
INSERT INTO pl VALUES ('a', 1), ('b', 2), ('c', 3), ('z', 26);
VACUUM ANALYZE pl;
EXPLAIN (COSTS OFF) SELECT * FROM pl WHERE k = 'a';
            QUERY PLAN             
-----------------------------------
 Seq Scan on pl_a pl
   Filter: ((k)::text = 'a'::text)
(2 rows)

EXPLAIN (COSTS OFF) SELECT * FROM pl WHERE k = 'a'::varchar;
            QUERY PLAN             
-----------------------------------
 Seq Scan on pl_a pl
   Filter: ((k)::text = 'a'::text)
(2 rows)

EXPLAIN (COSTS OFF) SELECT * FROM pl WHERE 'b' = k;
            QUERY PLAN             
-----------------------------------
 Seq Scan on pl_b pl
   Filter: ('b'::text = (k)::text)
(2 rows)

EXPLAIN (COSTS OFF) SELECT * FROM pl WHERE k IN ('a', 'c');
                     QUERY PLAN                      
-----------------------------------------------------
 Append
   ->  Seq Scan on pl_a pl_1
         Filter: ((k)::text = ANY ('{a,c}'::text[]))
   ->  Seq Scan on pl_b pl_2
         Filter: ((k)::text = ANY ('{a,c}'::text[]))
(5 rows)

EXPLAIN (COSTS OFF) SELECT * FROM pl WHERE k = ANY (ARRAY['a', 'z']::varchar[]);
                     QUERY PLAN                      
-----------------------------------------------------
 Append
   ->  Seq Scan on pl_a pl_1
         Filter: ((k)::text = ANY ('{a,z}'::text[]))
   ->  Seq Scan on pl_d pl_2
         Filter: ((k)::text = ANY ('{a,z}'::text[]))
(5 rows)

EXPLAIN (COSTS OFF) SELECT * FROM pl WHERE k = 'a'::name;
               QUERY PLAN                
-----------------------------------------
 Append
   ->  Seq Scan on pl_a pl_1
         Filter: ((k)::text = 'a'::name)
   ->  Seq Scan on pl_b pl_2
         Filter: ((k)::text = 'a'::name)
   ->  Seq Scan on pl_d pl_3
         Filter: ((k)::text = 'a'::name)
(7 rows)

EXPLAIN (COSTS OFF) SELECT * FROM pl WHERE k::text = 'a';
            QUERY PLAN             
-----------------------------------
 Seq Scan on pl_a pl
   Filter: ((k)::text = 'a'::text)
(2 rows)

EXPLAIN (COSTS OFF) SELECT * FROM pl WHERE k <> 'a';
                QUERY PLAN                
------------------------------------------
 Append
   ->  Seq Scan on pl_b pl_1
         Filter: ((k)::text <> 'a'::text)
   ->  Seq Scan on pl_d pl_2
         Filter: ((k)::text <> 'a'::text)
(5 rows)

EXPLAIN (COSTS OFF) SELECT * FROM pl WHERE k IS NULL;
      QUERY PLAN       
-----------------------
 Seq Scan on pl_d pl
   Filter: (k IS NULL)
(2 rows)

EXPLAIN (COSTS OFF) SELECT * FROM pl WHERE k < 'b';
               QUERY PLAN                
-----------------------------------------
 Append
   ->  Seq Scan on pl_a pl_1
         Filter: ((k)::text < 'b'::text)
   ->  Seq Scan on pl_d pl_2
         Filter: ((k)::text < 'b'::text)
(5 rows)

SELECT * FROM pl WHERE k = 'a'::varchar;
 k | n 
---+---
 a | 1
(1 row)

CREATE TABLE pc (k char(2), n int) PARTITION BY LIST (k);
CREATE TABLE pc_a PARTITION OF pc FOR VALUES IN ('a');
CREATE TABLE pc_d PARTITION OF pc DEFAULT;
INSERT INTO pc VALUES ('a', 1), ('b', 2);
EXPLAIN (COSTS OFF) SELECT * FROM pc WHERE k = 'a';
         QUERY PLAN          
-----------------------------
 Seq Scan on pc_a pc
   Filter: (k = 'a'::bpchar)
(2 rows)

EXPLAIN (COSTS OFF) SELECT * FROM pc WHERE k = 'a'::varchar;
         QUERY PLAN          
-----------------------------
 Seq Scan on pc_a pc
   Filter: (k = 'a'::bpchar)
(2 rows)

EXPLAIN (COSTS OFF) SELECT * FROM pc WHERE k = 'a'::text;
               QUERY PLAN                
-----------------------------------------
 Append
   ->  Seq Scan on pc_a pc_1
         Filter: ((k)::text = 'a'::text)
   ->  Seq Scan on pc_d pc_2
         Filter: ((k)::text = 'a'::text)
(5 rows)

SELECT * FROM pc WHERE k = 'a'::varchar;
 k  | n 
----+---
 a  | 1
(1 row)

-- ===== src/backend/rewrite/rewriteHandler.c:RewriteQuery|NodeTag (FromExpr) =====
CREATE TABLE rl (a int DEFAULT 99);
CREATE TABLE rl_log (a int, op text);
CREATE RULE rl_ins AS ON INSERT TO rl DO ALSO INSERT INTO rl_log VALUES (NEW.a, 'ins');
INSERT INTO rl VALUES (1), (2);
INSERT INTO rl VALUES (3);
INSERT INTO rl SELECT 4;
INSERT INTO rl DEFAULT VALUES;
INSERT INTO rl (a) VALUES (DEFAULT), (5);
INSERT INTO rl SELECT i FROM generate_series(6, 7) i WHERE i > 6;
WITH w AS (SELECT 8 AS a) INSERT INTO rl SELECT a FROM w;
ERROR:  0A000: WITH cannot be used in a query that is rewritten by rules into multiple queries
CREATE VIEW rv AS SELECT * FROM rl;
CREATE RULE rv_ins AS ON INSERT TO rv DO INSTEAD INSERT INTO rl VALUES (NEW.a * 10);
INSERT INTO rv VALUES (6), (7);
INSERT INTO rv SELECT 8;
INSERT INTO rv DEFAULT VALUES;
CREATE RULE rl_cond AS ON INSERT TO rl WHERE NEW.a > 50 DO ALSO INSERT INTO rl_log VALUES (NEW.a, 'big');
INSERT INTO rl VALUES (51), (2);
SELECT * FROM rl ORDER BY 1;
 a  
----
  1
  2
  2
  3
  4
  5
  7
 51
 60
 70
 80
 99
 99
   
(14 rows)

SELECT * FROM rl_log ORDER BY 1, 2;
 a  | op  
----+-----
  1 | ins
  2 | ins
  2 | ins
  3 | ins
  4 | ins
  5 | ins
  7 | ins
 51 | big
 51 | ins
 60 | ins
 70 | ins
 80 | ins
 99 | ins
 99 | ins
    | ins
(15 rows)

-- ===== src/backend/rewrite/rewriteManip.c:OffsetVarNodes_walker|NodeTag (AppendRelInfo) =====
-- pull-up of a subquery whose own UNION ALL was already flattened: the
-- subquery's append_rel_list entries are offset.
SELECT * FROM (SELECT * FROM (SELECT id FROM wa WHERE id < 3 UNION ALL SELECT id FROM wb WHERE id < 2) u) s ORDER BY 1;
 id 
----
  1
  1
  2
(3 rows)

EXPLAIN (COSTS OFF) SELECT * FROM (SELECT * FROM (SELECT id FROM wa WHERE id < 3 UNION ALL SELECT id FROM wb WHERE id < 2) u) s;
                QUERY PLAN                 
-------------------------------------------
 Append
   ->  Index Only Scan using wa_pkey on wa
         Index Cond: (id < 3)
   ->  Index Only Scan using wb_pkey on wb
         Index Cond: (id < 2)
(5 rows)

SELECT * FROM (SELECT u.id, u.id * 2 AS d FROM (SELECT id FROM wa WHERE id < 3 UNION ALL SELECT id FROM wb WHERE id < 2) u) s JOIN wb ON wb.id = s.id ORDER BY 1;
 id | d | id | y 
----+---+----+---
  1 | 2 |  1 | 1
  1 | 2 |  1 | 1
  2 | 4 |  2 | 2
(3 rows)

EXPLAIN (COSTS OFF) SELECT * FROM (SELECT u.id, u.id * 2 AS d FROM (SELECT id FROM wa WHERE id < 3 UNION ALL SELECT id FROM wb WHERE id < 2) u) s JOIN wb ON wb.id = s.id;
                         QUERY PLAN                         
------------------------------------------------------------
 Hash Join
   Hash Cond: (wb.id = wa.id)
   ->  Seq Scan on wb
   ->  Hash
         ->  Append
               ->  Index Only Scan using wa_pkey on wa
                     Index Cond: (id < 3)
               ->  Index Only Scan using wb_pkey on wb wb_1
                     Index Cond: (id < 2)
(9 rows)

SELECT * FROM wb, (SELECT * FROM (SELECT id FROM wa WHERE id < 3 UNION ALL SELECT id FROM wb WHERE id < 2) u) s WHERE s.id = wb.id ORDER BY 1, 2;
 id | y | id 
----+---+----
  1 | 1 |  1
  1 | 1 |  1
  2 | 2 |  2
(3 rows)

EXPLAIN (COSTS OFF) SELECT * FROM wb, (SELECT * FROM (SELECT id FROM pa WHERE id < 3 UNION ALL SELECT id FROM wb WHERE id < 2) u) s WHERE s.id = wb.id;
                         QUERY PLAN                         
------------------------------------------------------------
 Hash Join
   Hash Cond: (wb.id = pa.id)
   ->  Seq Scan on wb
   ->  Hash
         ->  Append
               ->  Seq Scan on pa1 pa
                     Filter: (id < 3)
               ->  Index Only Scan using wb_pkey on wb wb_1
                     Index Cond: (id < 2)
(9 rows)

-- ===== src/backend/optimizer/util/pathnode.c:path_is_reparameterizable_by_child|NodeTag (ForeignPath) =====
-- ===== src/backend/optimizer/util/pathnode.c:reparameterize_path_by_child|NodeTag (ForeignPath) =====
-- postgres_fdw builds scan paths parameterized by the *parent* of the other
-- side; a partitionwise nested loop must reparameterize them by the child.
-- With use_remote_estimate the parameterized scan wins, so the plan shows
-- "Remote SQL: ... WHERE ((id = $1::integer))" under the child Nested Loop.
-- (GatherPath stays unreachable: partial paths are never parameterized,
-- pathnode.c add_partial_path.)
CREATE EXTENSION postgres_fdw;
DO $$ BEGIN EXECUTE format('CREATE SERVER loopback FOREIGN DATA WRAPPER postgres_fdw OPTIONS (dbname ''postgres'', host ''127.0.0.1'', port %L)', current_setting('port')); END $$;
CREATE USER MAPPING FOR postgres SERVER loopback OPTIONS (user 'postgres');
CREATE TABLE fpa (id int, v text) PARTITION BY RANGE (id);
CREATE TABLE fpa1 PARTITION OF fpa FOR VALUES FROM (0) TO (100);
CREATE TABLE fpa2 PARTITION OF fpa FOR VALUES FROM (100) TO (200);
CREATE TABLE fpb (id int, w text) PARTITION BY RANGE (id);
CREATE TABLE fpb1_base (id int, w text);
CREATE TABLE fpb2_base (id int, w text);
CREATE INDEX ON fpb1_base (id);
CREATE INDEX ON fpb2_base (id);
CREATE FOREIGN TABLE fpb1 PARTITION OF fpb FOR VALUES FROM (0) TO (100) SERVER loopback OPTIONS (table_name 'fpb1_base');
CREATE FOREIGN TABLE fpb2 PARTITION OF fpb FOR VALUES FROM (100) TO (200) SERVER loopback OPTIONS (table_name 'fpb2_base');
INSERT INTO fpa SELECT i, 'a' || i FROM generate_series(0, 199) i;
INSERT INTO fpb1_base SELECT i, 'b' || i FROM generate_series(0, 99, 2) i;
INSERT INTO fpb2_base SELECT i, 'b' || i FROM generate_series(100, 199, 2) i;
VACUUM ANALYZE fpa;
VACUUM ANALYZE fpb1_base;
VACUUM ANALYZE fpb2_base;
ANALYZE fpb1;
ANALYZE fpb2;
SET enable_partitionwise_join = on;
SET enable_hashjoin = off; SET enable_mergejoin = off;
EXPLAIN (VERBOSE, COSTS OFF) SELECT * FROM fpa JOIN fpb ON fpa.id = fpb.id WHERE fpa.v IN ('a4', 'a150');
                            QUERY PLAN                             
-------------------------------------------------------------------
 Append
   ->  Nested Loop
         Output: fpa_1.id, fpa_1.v, fpb_1.id, fpb_1.w
         Join Filter: (fpa_1.id = fpb_1.id)
         ->  Foreign Scan on public.fpb1 fpb_1
               Output: fpb_1.id, fpb_1.w
               Remote SQL: SELECT id, w FROM public.fpb1_base
         ->  Materialize
               Output: fpa_1.id, fpa_1.v
               ->  Seq Scan on public.fpa1 fpa_1
                     Output: fpa_1.id, fpa_1.v
                     Filter: (fpa_1.v = ANY ('{a4,a150}'::text[]))
   ->  Nested Loop
         Output: fpa_2.id, fpa_2.v, fpb_2.id, fpb_2.w
         Join Filter: (fpa_2.id = fpb_2.id)
         ->  Foreign Scan on public.fpb2 fpb_2
               Output: fpb_2.id, fpb_2.w
               Remote SQL: SELECT id, w FROM public.fpb2_base
         ->  Materialize
               Output: fpa_2.id, fpa_2.v
               ->  Seq Scan on public.fpa2 fpa_2
                     Output: fpa_2.id, fpa_2.v
                     Filter: (fpa_2.v = ANY ('{a4,a150}'::text[]))
(23 rows)

SELECT * FROM fpa JOIN fpb ON fpa.id = fpb.id WHERE fpa.v IN ('a4', 'a150') ORDER BY 1;
 id  |  v   | id  |  w   
-----+------+-----+------
   4 | a4   |   4 | b4
 150 | a150 | 150 | b150
(2 rows)

ALTER SERVER loopback OPTIONS (ADD use_remote_estimate 'true');
EXPLAIN (VERBOSE, COSTS OFF) SELECT * FROM fpa JOIN fpb ON fpa.id = fpb.id WHERE fpa.v IN ('a4', 'a150');
                            QUERY PLAN                             
-------------------------------------------------------------------
 Append
   ->  Nested Loop
         Output: fpa_1.id, fpa_1.v, fpb_1.id, fpb_1.w
         Join Filter: (fpb_1.id = fpa_1.id)
         ->  Foreign Scan on public.fpb1 fpb_1
               Output: fpb_1.id, fpb_1.w
               Remote SQL: SELECT id, w FROM public.fpb1_base
         ->  Materialize
               Output: fpa_1.id, fpa_1.v
               ->  Seq Scan on public.fpa1 fpa_1
                     Output: fpa_1.id, fpa_1.v
                     Filter: (fpa_1.v = ANY ('{a4,a150}'::text[]))
   ->  Nested Loop
         Output: fpa_2.id, fpa_2.v, fpb_2.id, fpb_2.w
         Join Filter: (fpb_2.id = fpa_2.id)
         ->  Foreign Scan on public.fpb2 fpb_2
               Output: fpb_2.id, fpb_2.w
               Remote SQL: SELECT id, w FROM public.fpb2_base
         ->  Materialize
               Output: fpa_2.id, fpa_2.v
               ->  Seq Scan on public.fpa2 fpa_2
                     Output: fpa_2.id, fpa_2.v
                     Filter: (fpa_2.v = ANY ('{a4,a150}'::text[]))
(23 rows)

SELECT * FROM fpa JOIN fpb ON fpa.id = fpb.id WHERE fpa.v IN ('a4', 'a150') ORDER BY 1;
 id  |  v   | id  |  w   
-----+------+-----+------
   4 | a4   |   4 | b4
 150 | a150 | 150 | b150
(2 rows)

EXPLAIN (VERBOSE, COSTS OFF) SELECT * FROM fpa JOIN fpb ON fpa.id = fpb.id WHERE fpa.v = 'a4';
                                       QUERY PLAN                                        
-----------------------------------------------------------------------------------------
 Append
   ->  Nested Loop
         Output: fpa_1.id, fpa_1.v, fpb_1.id, fpb_1.w
         ->  Seq Scan on public.fpa1 fpa_1
               Output: fpa_1.id, fpa_1.v
               Filter: (fpa_1.v = 'a4'::text)
         ->  Foreign Scan on public.fpb1 fpb_1
               Output: fpb_1.id, fpb_1.w
               Remote SQL: SELECT id, w FROM public.fpb1_base WHERE ((id = $1::integer))
   ->  Nested Loop
         Output: fpa_2.id, fpa_2.v, fpb_2.id, fpb_2.w
         ->  Seq Scan on public.fpa2 fpa_2
               Output: fpa_2.id, fpa_2.v
               Filter: (fpa_2.v = 'a4'::text)
         ->  Foreign Scan on public.fpb2 fpb_2
               Output: fpb_2.id, fpb_2.w
               Remote SQL: SELECT id, w FROM public.fpb2_base WHERE ((id = $1::integer))
(17 rows)

SELECT * FROM fpa JOIN fpb ON fpa.id = fpb.id WHERE fpa.v = 'a4';
 id | v  | id | w  
----+----+----+----
  4 | a4 |  4 | b4
(1 row)

SET enable_partitionwise_join = off;
EXPLAIN (VERBOSE, COSTS OFF) SELECT * FROM fpa JOIN fpb ON fpa.id = fpb.id WHERE fpa.v IN ('a4', 'a150');
                            QUERY PLAN                             
-------------------------------------------------------------------
 Nested Loop
   Output: fpa.id, fpa.v, fpb.id, fpb.w
   Join Filter: (fpb.id = fpa.id)
   ->  Append
         ->  Foreign Scan on public.fpb1 fpb_1
               Output: fpb_1.id, fpb_1.w
               Remote SQL: SELECT id, w FROM public.fpb1_base
         ->  Foreign Scan on public.fpb2 fpb_2
               Output: fpb_2.id, fpb_2.w
               Remote SQL: SELECT id, w FROM public.fpb2_base
   ->  Materialize
         Output: fpa.id, fpa.v
         ->  Append
               ->  Seq Scan on public.fpa1 fpa_1
                     Output: fpa_1.id, fpa_1.v
                     Filter: (fpa_1.v = ANY ('{a4,a150}'::text[]))
               ->  Seq Scan on public.fpa2 fpa_2
                     Output: fpa_2.id, fpa_2.v
                     Filter: (fpa_2.v = ANY ('{a4,a150}'::text[]))
(19 rows)

SET enable_partitionwise_join = on;
SET max_parallel_workers_per_gather = 2;
EXPLAIN (VERBOSE, COSTS OFF) SELECT * FROM fpa JOIN fpb ON fpa.id = fpb.id WHERE fpa.v IN ('a4', 'a150');
                            QUERY PLAN                             
-------------------------------------------------------------------
 Append
   ->  Nested Loop
         Output: fpa_1.id, fpa_1.v, fpb_1.id, fpb_1.w
         Join Filter: (fpb_1.id = fpa_1.id)
         ->  Foreign Scan on public.fpb1 fpb_1
               Output: fpb_1.id, fpb_1.w
               Remote SQL: SELECT id, w FROM public.fpb1_base
         ->  Materialize
               Output: fpa_1.id, fpa_1.v
               ->  Seq Scan on public.fpa1 fpa_1
                     Output: fpa_1.id, fpa_1.v
                     Filter: (fpa_1.v = ANY ('{a4,a150}'::text[]))
   ->  Nested Loop
         Output: fpa_2.id, fpa_2.v, fpb_2.id, fpb_2.w
         Join Filter: (fpb_2.id = fpa_2.id)
         ->  Foreign Scan on public.fpb2 fpb_2
               Output: fpb_2.id, fpb_2.w
               Remote SQL: SELECT id, w FROM public.fpb2_base
         ->  Materialize
               Output: fpa_2.id, fpa_2.v
               ->  Seq Scan on public.fpa2 fpa_2
                     Output: fpa_2.id, fpa_2.v
                     Filter: (fpa_2.v = ANY ('{a4,a150}'::text[]))
(23 rows)

EXPLAIN (COSTS OFF) SELECT * FROM fpa JOIN pb ON fpa.id = pb.id WHERE fpa.v IN ('a4', 'a150');
                         QUERY PLAN                          
-------------------------------------------------------------
 Gather
   Workers Planned: 2
   ->  Parallel Append
         ->  Nested Loop
               Join Filter: (pb_1.id = fpa_1.id)
               ->  Parallel Seq Scan on fpa1 fpa_1
                     Filter: (v = ANY ('{a4,a150}'::text[]))
               ->  Seq Scan on pb1 pb_1
         ->  Nested Loop
               Join Filter: (pb_2.id = fpa_2.id)
               ->  Parallel Seq Scan on fpa2 fpa_2
                     Filter: (v = ANY ('{a4,a150}'::text[]))
               ->  Seq Scan on pb2 pb_2
(13 rows)

SET max_parallel_workers_per_gather = 0;
ALTER SERVER loopback OPTIONS (DROP use_remote_estimate);
RESET enable_hashjoin; RESET enable_mergejoin;
RESET enable_partitionwise_join;
-- ===== src/backend/executor/execCurrent.c:search_plan_tree|NodeTag (ForeignScanState) =====
-- WHERE CURRENT OF over a foreign scan never reaches search_plan_tree: the
-- planner refuses CURRENT OF on a foreign table first (0A000), and a cursor
-- over the foreign table is "not a simply updatable scan" of the base table.
CREATE TABLE cur_base (id int PRIMARY KEY, v text);
INSERT INTO cur_base VALUES (1, 'a'), (2, 'b');
CREATE FOREIGN TABLE cur_ft (id int, v text) SERVER loopback OPTIONS (table_name 'cur_base');
BEGIN;
DECLARE cur_c CURSOR FOR SELECT * FROM cur_ft;
FETCH 1 FROM cur_c;
 id | v 
----+---
  1 | a
(1 row)

UPDATE cur_ft SET v = 'z' WHERE CURRENT OF cur_c;
ERROR:  0A000: WHERE CURRENT OF is not supported for this table type
ROLLBACK;
BEGIN;
DECLARE cur_c CURSOR FOR SELECT * FROM cur_ft;
FETCH 1 FROM cur_c;
 id | v 
----+---
  1 | a
(1 row)

UPDATE cur_base SET v = 'z' WHERE CURRENT OF cur_c;
ERROR:  24000: cursor "cur_c" is not a simply updatable scan of table "cur_base"
ROLLBACK;
BEGIN;
DECLARE cur_c CURSOR FOR SELECT * FROM cur_ft FOR UPDATE;
FETCH 1 FROM cur_c;
 id | v 
----+---
  1 | a
(1 row)

DELETE FROM cur_ft WHERE CURRENT OF cur_c;
ERROR:  0A000: WHERE CURRENT OF is not supported for this table type
ROLLBACK;
BEGIN;
DECLARE cur_c CURSOR FOR SELECT * FROM cur_base;
FETCH 1 FROM cur_c;
 id | v 
----+---
  1 | a
(1 row)

UPDATE cur_base SET v = 'z' WHERE CURRENT OF cur_c;
SELECT * FROM cur_base ORDER BY id;
 id | v 
----+---
  1 | z
  2 | b
(2 rows)

ROLLBACK;
